Text,Label,text_cleaned
"@capn_mactastic *snuggles* Poor baby. At least you got out for a bit, that's something. Now stay in bed and snuggle w/animals. ",0,snuggle poor baby got bit something stay bed snuggle wanimals
@MortarWombat i want to ride my bicycle i want to ride my biiiike! ,0,want ride bicycle want ride biike
"pub visit, Guinness and some nice music this evening, then boxing on telly ",0,pub visit guinness nice music evening boxing telly
oh thats kewl tb im just watching tv  @sleeakgirl,0,oh thats kewl tb im just watching tv
"haha ashley tisdale's &quot;it's alright, it's ok&quot; is on TV  i wanna take my brush and sing as loud as i can :'DDD",0,haha ashley tisdale quotit alright okquot tv wanna brush sing loud dd
Good morning to everyone except the people that told me Jesus would fix my depression if I let him. (I'm going to a therapist for the first time today),1,good morning people told jesus fix depression let him i going therapist time today
"For some people, psychiatric diagnosis is helpful, and the problem is that it was not given early enough. For others, a diagnosis is deeply oppressive. What's your experience?  http://bit.ly/2JmldiAÂ #Psychiatry #MentalIllness #Schizophrenia #Depression #Borderline #OCD",1,people psychiatric diagnosis helpful problem not given early enough others diagnosis deeply oppressive experience mentalillness schizophrenia depression borderline ocd
"So...I'm about to start this aggressive medication for the next 6months. Side effects include depression, mood swings and skin reactions if I'm out in the sun...God help me!",1,soi start aggressive medication month effect include depression mood swing skin reaction sungod help me
no tears left to cry ended depression,1,tear left ended depression
@HawkShow A double sitting? Sit out in the garden with a lovely cold drink &amp; watch the sun go down instead ,0,double sitting sit garden lovely cold drink amp watch sun instead
You're not alone.#Depression #MentalHealthMatters https://twitter.com/WomenOfHistory/status/989050705544704000Â â¦,1,not alone depression mentalhealthmatters
"@TheBeaverton I love the overwhelming, omnipresent feeling of depression that permeates every sun blocked, filthy street corner, and the subtle yet inescapable ass smell of everywhere south of Bloor.",1,love overwhelming omnipresent feeling depression permeates sun blocked filthy street corner subtle inescapable as smell south bloor
@MikeStuchbery_  https://m.youtube.com/watch?feature=youtu.be&v=DQUgd9GQtoQÂ â¦ this was excellent talk on depression.  <Emoji: Moyai>,1,excellent talk depression emoji moyai
@DonnieWahlberg What happened to the Celtics? =(  I'm glad I'm an LA girl!   Utah's going DOWN!,0,happened celtic glad la girl utah going down
I love it when I am proud of the fact that I have brushed my teeth every night for the past three days like depression makes me disgusting,1,love proud fact brushed teeth night past day like depression make disgusting
"Hocking Fleur Bowl, Hocking Bowl Set, Anchor Hocking, Hocking Fleur, Chip and Dip Glass,Hocking Glass Bowl, Fleur Gold Dish, Depression  http://tuppu.net/1980de88Â  #Etsy #AbateVintage #FleurChipBowl https://www.etsy.com/AbateVintage/listing/495300722/hocking-fleur-bowl-hocking-bowl-set?utm_source=etsyfu&utm_medium=api&utm_campaign=apiÂ â¦",1,hocking fleur bowl hocking bowl set anchor hocking hocking fleur chip dip glasshocking glass bowl fleur gold dish depression etsy abatevintage fleurchipbowl
"Depression is a serious condition. I am diagnosed with anxiety and depression, but I do not let it define me. Whatever negative energy I feel, I put on paper. Art is my therapy, and not even depression can take that from me <Emoji: Heavy red heart><Emoji: Glowing star> #fuckdepression #320changedirection #LinkinPark",1,depression condition diagnosed anxiety depression not let define me negative energy feel paper art therapy not depression emoji heavy red heartemoji glowing star fuckdepression changedirection linkinpark
the great depression prolly the best album for me to listen to right now,1,great depression prolly best album listen right
@essentialimage what's crazy is I looked there first. you'd think sparrows would be easier to come by! I finally just made my own ,0,crazy looked first think sparrow easier come by finally just
Thoughts never saw light of dayBut what's Day to light And what's light to dayOne reminded me to hide in the shadows Console with depression and disdainAnd submerge myself into the oceans of the night sky with no moon or stars,1,thought saw light daybut day light light dayone reminded hide shadow console depression disdainand submerge ocean night sky moon star
@my858realtor Cute pic ,0,cute pic
I love the ringing in my ears...twas a good night ,0,love ringing earstwas good night
@TheOnion @ronjkoehler @LisaMartino18 breaking your depression one layer at a time?,1,breaking depression layer time
"Exercising regularly cuts risk of depression by 16%, study suggests  http://news.sky.com/story/exercising-regularly-cuts-risk-of-depression-by-16-study-suggests-11346264Â â¦ pic.twitter.com/z8NMgBVeBU",1,exercising regularly cut risk depression study suggests
@SEGA Start with the Virtua Tennis 2009 - training top ,0,start virtua tennis training
@PunishedBox No. I went straight to depression.,1,no went straight depression
my new hyper fixation is janelle monÃ¡e i love depression,1,new hyper fixation janelle mone love depression
theres depression and then theres eating half a block of cheese as a snack depression,1,there depression there eating half block cheese snack depression
Doing sketchy things. Love my life ,0,doing sketchy thing love life
"God I love maternity leave on hot,sunny, lazy, baby having good long sleeps days  long may it last.....",0,god love maternity leave hotsunny lazy baby having good long sleep day long last
"@sabowtage13 if i believed you, i'd be there in a second ",0,believed you second
If you're gunna dismiss the biological aspects of depression then cite mercury being in retrograde in the next sentence I don't wanna hear it,1,gunna dismiss biological aspect depression cite mercury retrograde sentence not wanna hear
Happy Gilmore is on ,0,happy gilmore
@WhatTheFFacts @bnperry1 I totally know this too. I just give up on life and am going to embrace it. Taking meds for depression really screwed up the way my body works so I quit the meds. The only thing that helps is having a dog.,1,totally know too just life going embrace it taking med depression really screwed way body work quit med thing help having dog
@kelpel Too late for me to try to fit in in NoCal. I've been here so long that I either fit in or there's no hope ,0,late try fit nocal long fit hope
On way to Birmingham.. Sewing in the van. Punk. ,0,way birmingham sewing van punk
Full on depression if my dog dies.,1,depression dog dy
@lyneL Glass of wine might help. ,0,glass wine help
"@rankfowler yeah, I'm talking about you! No, not really. But maybe. ",0,yeah talking you no not really maybe
Lot of thinking about  my depression and my recovery process been a very hard two years I'm there but when you're spouse turns her back on you worst feeling ever # depression is an illness i can say I would never turn my back on anyone <Emoji: Heavy red heart>,1,lot thinking depression recovery process hard year spouse turn worst feeling depression illness say turn emoji heavy red heart
I liked a @YouTube video  http://youtu.be/kSvJDeXnwXc?aÂ  Mensutra on Kapil Sharma's Depression and Phone Call Controversy!,1,liked video mensutra kapil sharma depression phone controversy
There are clear connections between depression and chronic pain. Here you have some explanation -  http://goo.gl/uzIlTlÂ ,1,clear connection depression chronic pain explanation
I'm out my depression life been goin smooth<Emoji: Smiling face with open mouth and cold sweat><Emoji: Star-struck>,1,depression life goin smoothemoji smiling face open mouth cold sweatemoji starstruck
Nothin' like a good book and some spring cleaning.  http://www.mrsdlightful.com/2009/04/food-storage-and-pantry-cleaning-tips.html,0,nothin like good book spring cleaning
I seal myself away in the depression orb,1,seal away depression orb
Watching Hatching Pete on disney. Haha =D @Jason_Dolley is sooo cute! Haha ,0,watching hatching pete disney haha soo cute haha
going to ikea ,0,going ikea
depression is real,1,depression real
Falling asleep here. So goodnight everyone ,0,falling asleep here goodnight
Thanks everyone for suggestions r.e. http://elearnr.org. Will keep it as-is for time being &amp; consider using it for staff CPD at Academy. ,0,thanks suggestion re asis time amp consider using staff cpd academy
@MattGLee ugh i've just been through all that.. it's the worst feeling!  don't worry something better will come up ,0,ugh just that worst feeling not worry better come
Yo it has been weeks since regions and post pmea depression is drawing me to this account.,1,yo week region post pmea depression drawing account
well i need to get to bed. chat at everyone tomorrow.  ,0,need bed chat tomorrow
@perrynoble I'm thinking it's a Chick-fil-a kinda morning there in Anderson. C'mon Perry...you know you wanna.  ,0,thinking chickfila kinda morning anderson c amon perryyou know wanna
Knetz are the ones who are stupid lmfao. Bom never did drugs so of course blackjacks will defend her to their graves. How fucking stupid can yall knetz get honestly like how many times do yall need to get told that those were PRESCRIBED MEDICINE FOR HER DEPRESSION,1,knetz one stupid lmfao bom did drug course blackjack defend graf fucking stupid yall knetz honestly like time yall need told prescribed medicine depression
@CharlotteLilly @goodlifegrspc @props4WAH @RavenSu @andykarelas @knittingnews @SusanCosmos thanks for the retweet ,0,thanks retweet
"And I guess, I just have to make sacrifices if I want to achieve my dreams. My family is very supportive at least (it's just, I can't stand living with them, as I need my own space and freedom; I feel trapped here). I just hope I can work through the stress and depression.",1,guess just make sacrifice want achieve dream family supportive it just stand living them need space freedom feel trapped here just hope work stress depression
whatching Camp Rock! ,0,whatching camp rock
gooood morning ,0,good morning
@Momisodes Mine are from zazzle and I love them ,0,zazzle love
@roflucy algebra is easy lucy ,0,algebra easy lucy
Vintage 1930s Mayfair Pink Depression Glass Candy Jar With Lid Open Rose Pattern  https://etsy.me/2Js2NxcÂ  via @Etsy,1,vintage s mayfair pink depression glass candy jar lid open rose pattern
lol. i just realized my room has a color theme. green is definitely growing in on me. go green! hahaha. i still love purple though! ,0,lol just realized room color theme green definitely growing me green hahaha love purple though
it's after 3 AM.!!  I think it's time to bed.!!  have a good night twitts.! ;)),0,am think time bed good night twitts
Depression is a normal thing in this generation.. u ain't gonna die from it bro.. keep your head up.,1,depression normal thing generation u ai not gonna die bro head up
"I've never understood why Churchill called depression his Black Dog. I can think of few things more life affirming than a big, daft, mutt chasing me through the world.",1,understood churchill called depression black dog think thing life affirming big daft mutt chasing world
@find_hope remember when @deyderz had no idea how to use twitter but now she's a bigger tweeter than us?? ,0,remember idea use twitter bigger tweeter u
@itswendylou Thank you  Happy Saturday to you too!,0,thank happy saturday too
wwwwwwwwwwoooooooooo its sunny dayyyy! ,0,sunny dayy
Wow depression really thinks she's that bitch,1,wow depression really think bitch
this photo cleared my acne cured my depression and extended my lifespan  pic.twitter.com/jZe6YFY2UJ,1,photo cleared acne cured depression extended lifespan
// Fighting depression is really vexing.,1,fighting depression really vexing
finds it interesting that a Vespa counts as a motorcycle in Maryland and Florida  AWESOME!!!!,0,find interesting vespa count motorcycle maryland florida awesome
"@MsATC haha...not 'Club Buca is closed'! LOL...I miss you too  I don't go out on Thurs, Cynt does. How are you?",0,hahanot club buca closed loli miss not thurs cynt doe you
Feeling better and hoping we all allow ourselves to be open to the possibilities ,0,feeling better hoping allow open possibility
@___daniela : thats the one I just got. its good but strong; but im mixing the whipped cream into it so its better ,0,thats just got good strong im mixing whipped cream better
"being pan, having ghey friends, leaning to the leftist side of politics, being medicated for depression, showin my face without makeup.......do yall think itll do",1,pan having ghey friend leaning leftist politics medicated depression showin face makeupdo yall think itll
@VoodooChildZoso  yeah i managed to catch it around 3am...was sure glad i did! ,0,yeah managed catch amwas sure glad did
depression hitting hard this morning,1,depression hitting hard morning
@nansforever Depression? With sparkles of a fading sunshine,1,depression sparkle fading sunshine
"@Kyzon_Xin Damn...Mine is different from yours..Not really involving money, it's more toward emotions, depression, not feeling like myself, don't know who I am anymore, anxiety, sleepless nights, feeling like I've given up, thinking about death, questioning life...It adds up..<Emoji: Crying face><Emoji: Crying face><Emoji: Crying face>",1,damnmine different yoursnot really involving money emotion depression not feeling like myself not know anymore anxiety sleepless night feeling like given up thinking death questioning lifeit add upemoji cry faceemoji cry faceemoji cry face
uhm so nothing bothered me today ,0,uhm bothered today
"Just one puff of cannabis 'could ease depression, stress and anxiety' - The Sun  https://goo.gl/fb/WhxNCLÂ ",1,just puff cannabis could ease depression stress anxiety sun
Jab bohat ziada tension aur depression ho to relax honay kay liay kya karna chaiay Need suggestions,1,jab bohat ziada tension aur depression ho relax honay kay liay kya karna chaiay need suggestion
"Depression.Love, Rap  https://twitter.com/PoemPorns/status/989172433193177089Â â¦",1,depressionlove rap
If you'd rather force yourself in a relationship because you want to feel loved than learning to love yourself that's a huge issue. Stop running. Depression and the feeling of loneliness is the first steps to being free.,1,force relationship want feel loved learning love huge issue stop running depression feeling loneliness step free
rubbish day of revision ..  but Take That in 8 days !! ,0,rubbish day revision day
"What were you taught in school? Have you ever independently researched the Great Depression, to prove or disprove what you were taught?  https://www.facebook.com/VPAofTX/posts/1912767898797971Â â¦",1,taught school independently researched great depression prove disprove taught
Enjoying the nice cool breeze of my new desk fan ,0,enjoying nice cool breeze new desk fan
"@garrbage Insecurity, depression and psychological projection",1,insecurity depression psychological projection
"Ketamine Nasal Spray Shows Promise Against Depression, Suicide #health  https://cmun.it/lu4yifÂ  - <Emoji: Rocket>Grow your followers with  https://commun.it/grow-your-followers/?tc=n&aid=content_15Â â¦",1,ketamine nasal spray show promise depression suicide health emoji rocketgrow follower
<Emoji: Pill>Depression? Bronchodilation? Palpitations?Call now to learn about Anosulfideâ¢!Do not use in conjunction with Bibioxyphosphoate (sold as Sterosronâ¢),1,emoji pilldepression bronchodilation palpitationscall learn anosulfidedo not use conjunction bibioxyphosphoate sold sterosron
I don't have the job yet. But hopefully soon. Thanks! @notoriousflirt: @avengelynne Sweet! Congrats! ,0,not job yet hopefully soon thanks sweet congrats
I need a peace ,0,need peace
@kristenstewart9 Good luck! ,0,good luck
going to sleep with the sound of halo 3 and two happy boys ,0,going sleep sound halo happy boy
@mommysnacks  Did you mean to make your blog invite only? I had one of your readers email me by mistake asking for permission to read it. ,0,did mean make blog invite only reader email mistake asking permission read it
it's so unfair that we have to worry about bom. a girl who was brave enough to treat her depression and could be such a great example to other people. she was taking a huge step and got pulled back down by ignorant assholes. bom deserves so much better :( #ë°ë´ì ë°ë´ë²ë ¤ëì¸ì,1,unfair worry bom girl brave treat depression great example people taking huge step got pulled ignorant asshole bom deserves better
The freaking Circus was awesome!  Dude I loved it.,0,freaking circus awesome dude loved it
@emceet I'm headed 2 hang out with my friend right now but I will def have it done by tomorrow! I'll hit u up as soon as its done ,0,headed hang friend right def tomorrow hit u soon
"#africa #tech It doesn't matter where you live, what your gender is, or how old you areâsliding into a pair of running shoes may be your best first step to warding off depression.An international team of researchers from Kings College in London came â¦  https://ift.tt/2qYemo7Â ",1,africa tech doe not matter live gender is old aresliding pair running shoe best step warding depressionan international team researcher king college london came
@DiVa525 oh it's undeniably me ,0,oh undeniably
Wowzers not been on here for a while. I refuse to submit to the monday morning blues i'm guna smile allday ,0,wowzers not while refuse submit monday morning blue guna smile allday
@CRISCOKIDD i just might jack your style on your twitter replies lol ,0,just jack style twitter reply lol
bruh i just spoke to my advisor and i have Depression,1,bruh just spoke advisor depression
Just had my mom on the phone. I will be in Lille next week end ,0,just mom phone lille week end
just did copy cat ksnm... made over 300k  ~Caravaggio~,0,just did copy cat ksnm k caravaggio
@RoxOnFox Hey whats good Roxanna? ,0,hey whats good roxanna
@jenalfano where is the link? I dont see it. ,0,link dont it
Gonna weight myself to fall into deeper depression,1,gonna weight fall deeper depression
The Social Epidemic That Doubles Depression And Anxiety Risk  https://ift.tt/2FdyZlbÂ  via PsyBlog,1,social epidemic double depression anxiety risk psyblog
Hahahahaha.  O feeeeel ya. And then I gave it up. No more depression. Funny how that worked.  Brother no judgement just the facts. <Emoji: Smiling face with halo><Emoji: Smiling face with halo><Emoji: Smiling face with halo>  https://twitter.com/KingDivine315/status/989239728640811008Â â¦,1,hahahahaha o feel ya gave up depression funny worked brother judgement just fact emoji smiling face haloemoji smiling face haloemoji smiling face halo
Im gonna from this depression #infinitywar,1,im gonna depression infinitywar
"@rEDGYbrecker Not joking, I think he has a bipolar disorder that causes manic episodes followed by periods of crippling depression. This behavior goes back some years",1,not joking think bipolar disorder cause manic episode followed period crippling depression behavior go year
Or maybe because she studied about depression. I dunno. Now that both me and my brother has it. And also we have sinus. Are we twins? Lol. Tapi financial belum sama lagi. <Emoji: Face with tears of joy>,1,maybe studied depression dunno brother it sinus twin lol tapi financial belum sama lagi emoji face tear joy
Depression mood:<Emoji: Heavy check mark>,1,depression moodemoji heavy check mark
@tommsinclair Nice  And even better... Three day weekend just hours away!,0,nice better day weekend just hour away
"@pleasefindthis well then on behalf of everyone, thank you. I look forward to reading your posts every time there's a new one ",0,behalf everyone thank you look forward reading post time new
DEPRESSION SUCKS.,1,depression suck
"@RapeCrisisEandW We weren't looking for compensation, although would've supported her. We were looking for justice. She developed anorexia, attempted suicide and continues to have terrible bouts of depression & anxiety. Meanwhile he has children around him.",1,not looking compensation supported her looking justice developed anorexia attempted suicide continues terrible bout depression anxiety child him
@CarlitoStaxx Krisy kreme only if the hot sign is on ,0,krisy kreme hot sign
An equilibrium level of gdp can occur while resources are less than fully employed or are under utilized therefore the grate depression of the 1930s can be seen as a static condition rather than a self correcting transition period,1,equilibrium level gdp occur resource fully employed utilized grate depression s seen static condition self correcting transition period
"Wishing a great Mother's Day to my mom, Nana, and the other mom's I know. ",0,wishing great mother day mom nana mom know
Dealing with depression isn't easy - here's a few things you shouldn't say to someone who's suffering >>  http://annesmiles.com/never-say-to-person-with-depression/Â â¦,1,dealing depression not easy thing not say suffering
I'm Forgot all my problems and depression when you're with me for aâ¦  https://www.instagram.com/p/BiAR6_wHKsz9Nx8kIoOc8ajE_berEjKXPDXZlQ0/Â â¦,1,forgot problem depression
Out to eat with the family ,0,eat family
That feeling when you realize depression took control again and you suddenly want to pump out a 12 gauge through your face  pic.twitter.com/L5RmfiiQqi,1,feeling realize depression took control suddenly want pump gauge face
Having a beer &amp; corn dog (I know weird combo) @ the Santa Monica Pier. ,0,having beer amp corn dog i know weird combo santa monica pier
Wow. Crest glide is great. ,0,wow crest glide great
Watching Sabrina the Teenage Witch episode where her aunts make her a dream date out of man dough. It's my favorite episode ,0,watching sabrina teenage witch episode aunt make dream date man dough favorite episode
"@GAustinnnnn no success comes easy, your going to make it! ",0,success come easy going make it
"Mom's depression tied to kids' emotional, intellectual development  https://ift.tt/2HvE3DsÂ  ",1,mom depression tied kid emotional intellectual development
has three competition running at the moment - gig tickets &amp; sunglasses  check out www.onesmallseed.net to find out all the details.,0,competition running moment gig ticket amp sunglass check net detail
"Charlize Theron Talks Battle With Depression, Admits She Ate Potato Chips Everywhere To Gain Almost 50 Pounds  http://a.msn.com/07/en-ca/AAwjt3y?ocid=stÂ â¦",1,charlize theron talk battle depression admits ate potato chip gain pound
"Apparently I'm in a state of moderate depression, what a good day to be alive !  pic.twitter.com/WqovF9Diil",1,apparently state moderate depression good day alive
":'( Policeman kills himself over loan, frustration at work #depression  https://www.standardmedia.co.ke/article/2001278200/police-officer-commits-suicide-over-bank-loansÂ â¦ via @StandardKenya",1,policeman kill loan frustration work depression
"girls night out!  word, word, word!",0,girl night out word word word
"Hello depression my old friend, kindly fuck off <Emoji: Kiss mark><Emoji: Kiss mark>",1,hello depression old friend kindly fuck emoji kiss markemoji kiss mark
"anyway cripple is a slur and if you're not physically disabled don't fucking use it! (Yes, that includes all y'all saying crippling depression/other non physical illness/disability)",1,cripple slur not physically disabled not fucking use it yes includes yall saying crippling depressionother non physical illnessdisability
@djmissbehavior wow your myspace prof pic is hott! ,0,wow myspace prof pic hott
"You could laugh at her clothes, PR, and her boring interviews but don't you dare question her depression bitch.",1,laugh clothes pr boring interview not dare question depression bitch
i:heart:talpa jocotes ,0,ihearttalpa jocote
pack pack pack pack pack  Punta Cana in three days! yayyy,0,pack pack pack pack pack punta cana day yayy
Playing some Badminton with my sister ,0,playing badminton sister
Volunteering 2 day at my sis's school. ,0,volunteering day si school
@SamiHernandez5 honey i told you that you can't listen to this song so often or else you'll spiral into a monsoon of depression and passion,1,honey told listen song spiral monsoon depression passion
@ksymmonds @SarahSymmonds My pleasure - great site - use it a lot for me iPhone ringtones ,0,pleasure great site use lot iphone ringtones
@Miyukiko YOU LOVE IT LOL ,0,love lol
still awake at 5:04 watching @TdashRich ,0,awake watching
@richardquest I might go shopping and eat out. Weekends are a great time to do that. ,0,shopping eat out weekend great time that
#Science Says People Who Burn Frankincense Are Less Likely To Suffer From #Depression http://bit.ly/1SJ3NhhÂ  pic.twitter.com/9IvbFCmSId,1,science say people burn frankincense likely suffer depression
packing for Europe...  stoked...,0,packing europe stoked
Statesboro fun this a.m. and I'm off to see the GreenJackets in Augusta tonight! ,0,statesboro fun am greenjackets augusta tonight
Is school depression a thing bc I think I have it,1,school depression thing bc think
"@remzology Hay thanks for the comment! And yes, I am trying my best to make the most of these few days! ",0,hay thanks comment yes trying best make day
Sweet home Chicago  i wouldnt trade it for the world ,0,sweet home chicago wouldnt trade world
"my BIS connection is KapuT, no BBM, feels lonely ",0,bi connection kaput bbm feel lonely
"Depression and sore throat, halaloya.",1,depression sore throat halaloya
Cats and Dogs FTW (Y) The dogs are soooo cute ,0,cat dog ftw y dog soo cute
