Text,Label,text_cleaned
"really want to do some art but not feeling motivated *cough cough* slight depression *cough*but yea I'll try and get that redraw done soon, altho there are a lot of projects that I have to do for school and other homework",1,really want art not feeling motivated cough cough slight depression coughbut yea try redraw soon altho lot project school homework
"Got a sweater, now I'm warm. ",0,got sweater warm
"@KatyLewy9 We all suffer from severe depression at least one time of our lives. But we all rise above stronger than ever, just keep going and fighting!!! We support and love you  pic.twitter.com/VlhaVrTfuJ",1,suffer severe depression time life rise stronger ever just going fighting support love
17 Again was the best movie ever!I think everyone should do themselves justice and go and see it.For me...  ,0,best movie everi think justice itfor me
I think we have cute mormon boys..just those two though.  [23],0,think cute mormon boysjust though
"@WayneNH I wish I wasn't following you so I could be your 1,000 follower, Wayne ",0,wish not following follower wayne
When depression hits so does anxiety.,1,depression hit doe anxiety
Have first appointment tomorrow with the new care co-ordinator. I am already dreading it and don't want to meet him despite knowing them. I'm cross and frustrated knowing I will be blamed for my mistakes! #MentalHealthAwareness #PTSD #EUPD #anxiety #depression #struggling,1,appointment tomorrow new care coordinator dreading not want meet despite knowing them cross frustrated knowing blamed mistake mentalhealthawareness ptsd eupd anxiety depression struggling
"@jeremy_lim ah awesome man, good to hear! Felt like it went well on the night too, really enjoyed it!! Can't wait to come back now ",0,ah awesome man good hear felt like went night too really enjoyed it ca not wait come
I have severe depression,1,severe depression
"@pjakobs as in, someone would figure out how to access the mp3s without actually paying for them. ",0,in figure access mp actually paying them
"Nintendo should have come on stage and said - &quot;Buy us, we're cheaper&quot; and it would have been better than this.  #E3",0,nintendo come stage said quotbuy u cheaperquot better this e
"@Onision no. it isn't. stop romanticising depression you fucking onion. aren't you the one who said that people choose to be depressed and mock people with deppresion? oh yeah, you are! stop being fake woke to try to impress your underage fans on the internet and be an actual father.",1,no not stop romanticising depression fucking onion not said people choose depressed mock people deppresion oh yeah are stop fake woke try impress underage fan internet actual father
"@ScienceDaily Factors associated w increased #overdose risk r disorders involving the use of alcohol, cocaine, amphetamines and histories of depression, anxiety or eating disorders--new study of adolescents. Solution: early diagnosis & treatment. @sciencedaily @ASAMorg https://www.sciencedaily.com/releases/2018/04/180424141140.htmÂ â¦",1,factor associated w increased overdose risk r disorder involving use alcohol cocaine amphetamine history depression anxiety eating disordersnew study adolescent solution early diagnosis treatment
"Mm mm mm, so fresh &amp; so clean from the top of my head to the toes  I'm on my way to Corney &amp; Barrows now for reach for sound check xx",0,mm mm mm fresh amp clean head toe way corney amp barrow reach sound check xx
depression fucking sucks thanks,1,depression fucking suck thanks
@EmmaLight I'd forgotten about that  We need to do that again sometime.,0,forgotten need sometime
Made myself a tortilla filled with pb&j. My depression is cured. Olivia:1 depression:0,1,tortilla filled pbj depression cured olivia depression
@Mummy_Fitz I am taking a dad with me ,0,taking dad
@RAVisionMedia @yourrightscamp @amnesty @Kaepernick7 Floride? Medications? Domestication? Depression?  Read The Four Agreements. We a collectively sleep walking. But we are also waking up. Keep being the warriors for waking up.,1,floride medication domestication depression read agreement collectively sleep walking waking up warrior waking up
@itslmo I'm waiting for a seat sale for October flights on BA. I'm refusing to pay full-fare as ever - esp this year. ,0,waiting seat sale october flight ba refusing pay fullfare esp year
@ferarospizza wine buzz and darts...?? Well...can't say I've never done it - have fun!  http://twurl.nl/dr3wya,0,wine buzz dart well say fun
"@TalulaKim I have the yearbook in the closet-I'll look it up 2moro if u are still curious  -Um, where did @Ki6bjv go to school exactly?LOL",0,yearbook closeti look moro u curious um did school exactlylol
evens a really good depressed character btw like obvs everything in this show is unrealistic and pathetic but its good to see depression - especially manic depression - shown through a person instead of a film character yknow,1,even really good depressed character btw like obvs unrealistic pathetic good depression especially manic depression shown person instead film character yknow
@claritynow i write music and sometimes my inner thoughts  i will check it out now!,0,write music inner thought check now
I know what you mean. I too have a very difficult time staying positive. I feel like my Depression has taken on a life of its own; I feel like my Depression prevents me from staying positive  https://twitter.com/nar_narbaby/status/988992029077196801Â â¦,1,know mean difficult time staying positive feel like depression taken life own feel like depression prevents staying positive
"Hi there, my name is Kuuku. Are you struggling with disappointment, depression, suicidal thoughts, anger, or do you feel lost and left behind in life? I have also been in situations in which I needed someone to talk to. You can definitely talk to me. DM me",1,hi there kuuku struggling disappointment depression suicidal thought anger feel lost left life situation needed talk to definitely talk me dm
@Qso Since when is playing the piano messy?  I always thought its the other way round...,0,playing piano messy thought way round
"wyn takes 5 mins to prepare to go out, while mel takes 5 hours.  :p  happy birthday again my friend!",0,wyn take min prepare out mel take hour happy birthday friend
"Having been in the PL & not involved in my lifetime, I've just been watching highlights of every Championship play off final game since 2005. And my god, the reward for winning is total ecstasy, the price for losing is suicidal depression, can't wait. <Emoji: Upside-down face>(If we get there) UTV",1,having pl not involved lifetime just watching highlight championship play final game god reward winning total ecstasy price losing suicidal depression wait emoji upsidedown faceif there utv
@MikeSonko @RobertAlai @lustborn You  are jst  waste to society of Kenya. Don't you know that insulting someone can cause brain damage here I'm talking about (depression?,1,jst waste society kenya not know insulting cause brain damage talking depression
@JustBongs_ And it's never easy to bounce back once the relationship is done with u. A low self-esteem and depression are the results of such. Yhu ha.a ngeke <Emoji: Loudly crying face><Emoji: Loudly crying face>,1,easy bounce relationship u low selfesteem depression result such yhu haa ngeke emoji loudly cry faceemoji loudly cry face
@cheomitII @ETVPod @thoughtspctrum I'm pretty sure if someone had exposed me to that term and explained what it meant I could have avoided alot of unnecessary mental/emotional isolation and depression. It's an extremely useful term. I wish you could see the importance and nuance that it really does convey.,1,pretty sure exposed term explained meant avoided alot unnecessary mentalemotional isolation depression extremely useful term wish importance nuance really doe convey
"Happy Birthday Big Ben, may you chime for another 150 years and more ",0,happy birthday big ben chime year
Thoughts on the ascent of the AKP in Turkey in 'The Third Great Depression and rise of the far-right: experiences from Turkey' by Burak GÃ¼rel for the @TheErpi writing in @openDemocracy @stepscentre @nathan_oxley https://www.opendemocracy.net/burak-g-rel/third-great-depression-and-rise-of-far-right-experiences-from-turkeyÂ â¦,1,thought ascent akp turkey the great depression rise farright experience turkey burak grel writing
http://twitpic.com/6cao4 - My Saturday Night ,0,saturday night
Beautiful day outside . I'm going to uni  then to workshop for bloggers delight ,0,beautiful day outside going uni workshop blogger delight
If you have depression the we are already friends:),1,depression friend
Great Gatsby Setting As a Prequel to the Great Depression -  http://www.blogging.blogs4all.co.uk/economics/great-gatsby-setting-as-a-prequel-to-the-great-depression/Â â¦,1,great gatsby setting prequel great depression
"Me: Okay, time to get over myself. I'm not spending another day in bed, wallowing in depression.My brian:  pic.twitter.com/Yw1qk3Ar3R",1,me okay time myself not spending day bed wallowing depressionmy brian
hooked up to Restaurant City  wish i could have one for reaalllls... nyahahaha ),0,hooked restaurant city wish reaalls nyahahaha
Watched Will Ferrell on Man vs Wild w/ Bear Grylls....funny stuff ,0,watched ferrell man v wild w bear gryllsfunny stuff
"We're all aware of the great effects of #exercise on our physical health, but a fantastic study by @AmJPsychiatry has shown the positive effects can have on our #mentalhealth Exercise can help reducing depression, so take advantage! #exerciseworks  https://www.maudsleybrc.nihr.ac.uk/posts/2018/april/engaging-in-physical-activity-decreases-people-s-chance-of-developing-depression/Â â¦",1,aware great effect exercise physical health fantastic study shown positive effect mentalhealth exercise help reducing depression advantage exerciseworks
Song Of The Day..... RUN DON'T WALK by HEY MONDAY.... cassadee rocks out like 24/7 love her ,0,song day run dont walk hey monday cassadee rock like love
"ayo three 6 mafia, Keri Hilson, and GUCCI on a track?!?! I'm all ears for that one yall hurr up ",0,ayo mafia keri hilson gucci track ear yall hurr
How exercising can slash the risk of depression: https://cse.google.com/cse?cx=partner-pub-0438138242743153%3Avvnwpsw8fe0&ie=UTF-8&q= https%3A%2F%2Fnypost.com%2F2018%2F04%2F24%2Fhow-exercising-can-slash-the-risk-of-depression%2F&sa=Search&siteurl=www.google.com%2Fcse%2Fhome%3Fcx%3Dpartner-pub-0438138242743153%3Avvnwpsw8fe0#gsc.tab=0&gsc.q= https%3A%2F%2Fnypost.com%2F2018%2F04%2F24%2Fhow-exercising-can-slash-the-risk-of-depression%2F&gsc.page=1Â â¦,1,exercising slash risk depression httpsaffnypostcomffhowexercisingcanslashtheriskofdepressionfsaearchsiteurlcomfcsefhomefcxdpartnerpubavvnwpswfe gsctabgscq httpsaffnypostcomffhowexercisingcanslashtheriskofdepressionfgscpage
LOL fia you can't kill me ,0,lol fia kill
Lack of sexual interest is a symptom of depressionMe: that explains SOOO MUCH,1,lack sexual symptom depressionme explains soo
Sittin outside Tomatinos enjoying this beautiful evening ,0,sittin outside tomatinos enjoying beautiful evening
Watching my DVR.. Conan!  http://bit.ly/1mahf8,0,watching dvr conan
@VinceParr: Star Trek! By a mile. ,0,star trek mile
Topic 3/4: Mental Health and Substance Use. Paired topics due to sequelae. Text focused on anxiety and depression. States that anxiety is a given consequence of gay-related victimization. Gay and bisexual men experience higher levels of psychological stress,1,topic mental health substance use paired topic sequela text focused anxiety depression state anxiety given consequence gayrelated victimization gay bisexual men experience higher level psychological stress
"Aaaaaand here comes the depression, I was waiting for you",1,aand come depression waiting
"@macitout and recording music here with Nona Hendryx of Labelle. Hit me back sometime. Hope to talk to you soon. Best, Alex ",0,recording music nona hendryx labelle hit sometime hope talk soon best alex
Hello world! Listen the Radio Dabas online: www.radiodabas.hu left corner above - PRï¿½BA SZERENCSE ,0,hello world listen radio daba online hu left corner prba szerencse
my depression is so depressed,1,depression depressed
@ReemaHamdan Don't you dare get sick!  ,0,not dare sick
I love how you say you suffer depression when you probably live in a house and have food every day and electricity. Just get ov... â I see this argument popping up a lot when it comes to depression so I have something to say: depr...  https://curiouscat.me/cutiepienestor/post/429598999?1524670430Â â¦,1,love say suffer depression probably live house food day electricity just ov argument popping lot come depression say depr
"Thinking of a new video Idea. Hmm, Maybe explosive couches? Just a thought. ",0,thinking new video idea hmm maybe explosive couch just thought
LIKE I HAVE SO MUCH FUCKING LOVE TO GIVE THAT AS SOON AS SOMEONE STARTS TALKING TO ME I GET SO OBSESSED BUT THEY DON'T FEEL THE SAME WAY AND THEN I END UP FOREVER ALONE WITH FUCKING MISS DEPRESSION RUINNING MY LIFE  pic.twitter.com/CfhTKxqqqa,1,like fucking love soon start talking obsessed dont feel way end forever fucking miss depression ruinning life
I &lt;3 memory foam ,0,lt memory foam
"Proceeds from May 12 Dreambuilders Ball support innovations at @VirginiaMason, like Volunteer Companion Program. In this donor-funded program, volunteers visit patients, listen and show compassion to combat loneliness and depression for admitted patients.  http://pbynd.co/2v6grÂ ",1,proceeds dreambuilders ball support innovation like volunteer companion program donorfunded program volunteer visit patient listen compassion combat loneliness depression admitted patient
@bellatela`s SINGINGGGG.  Haha. I love it when she sings because she`s so good. :&gt; ))),0,s singingg haha love sings shes good gt
Korea is the most hypocritical country. They cry the death of someone who died of depression but they harass a woman who tried to cure her depression. I cannot. #protectparkbom1115 pic.twitter.com/q4QxKLAkn7,1,korea hypocritical country death died depression harass woman tried cure depression cannot protectparkbom
@AusBorderForce @PeterDutton_MP @shanebazzi Agreed <Emoji: Clapping hands sign><Emoji: Clapping hands sign><Emoji: Clapping hands sign>As someone with long experience of clinical depression I'd like to add this:Of course she fuckingwell yells and hits her head on the wall and says she wants to dieNobody can live forever without hopeShe won't get better while kept indefinitely on Nauru,1,agreed emoji clapping hand signemoji clapping hand signemoji clapping hand signas long experience clinical depression like add thisf course fuckingwell yell hit head wall say want dienobody live forever hopeshe not better kept indefinitely nauru
I'm bored. Gonna paint my nails and then watch Driving Lessons in bed ,0,bored gonna paint nail watch driving lesson bed
"#TMS Therapy is a safe and effective treatment option for #depression. If you're interested in learning more and seeing if TMS is right for you, then contact our office today.  https://www.facebook.com/VenturaCountyTMS/videos/1492539724205071/Â â¦",1,tm therapy safe effective treatment option depression interested learning seeing tm right you contact office today
@Thebombshell okie doke bestie! ,0,okie doke bestie
hahaa..you will not!did you watch SFTW?  i hear u went for dinner on thurs night with anishahow is she??,0,hahaayou notdid watch sftw hear u went dinner thurs night anishahow she
"@anthony_hill Didn't take me on as Production Editor as not enough experience, but asked me to start as an Ed Assistant as they liked me ",0,did not production editor not experience asked start ed assistant liked
@partywithneha I think @twilightfairy  can explain more  @paavani @netra @sharanya @sanjukta @tarushikha,0,think explain
@Mark_Stringer and @geechee_girl how weird/cool that two people from my two lives should meet on Twitter ,0,weirdcool people life meet twitter
@momagus Teehee too true!! ,0,teehee true
http://bit.ly/1a4vu2 /19/2nTSU-mFWGs cutest song ever ,0,ntsumfwgs cutest song
Lol... Yay Teo is followin me.   miss u hon. {{leg squeezes}} http://myloc.me/2lsr,0,lol yay teo followin me miss u hon leg squeeze
"Mounting evidence shows exercise can prevent depression  https://buff.ly/2HXS3agÂ  Yep, that's why I am happy :) pic.twitter.com/4m8QZPUtQI",1,mounting evidence show exercise prevent depression yep happy
Some people may say you can't be sad because someone else may have it worse is just like saying someone can't be happy because someone else might have it better. Depression is one of the most dehumanization and tiring emotional experience anyone can encounter in their life,1,people say sad worse just like saying happy better depression dehumanization tiring emotional experience encounter life
@GADataGuy You too have a great day ,0,great day
its my best friends birthdayyy!!!!! ,0,best friend birthdayy
@moodster614 it's wubsy ha asshole ,0,wubsy ha asshole
Going running with Smalley and Cougar. This could be interesting. ,0,going running smalley cougar interesting
@JustinePHAC @agnosticQuest @onfiremission The talk is about resilience - recognition that pain and suffering is normal is part of the healing process.  Depression can make it seem that we are alone and unique in our suffering - recognition that we aren't is essential to health.,1,talk resilience recognition pain suffering normal healing process depression make unique suffering recognition not essential health
@Zealous_Larenz @AmbitioVerumEst I'm not a fan of drugs (or plant based solutions) but I'm all for social exercises to combat clinical depression.,1,not fan drug or plant based solution social exercise combat clinical depression
the real depression hours #The100 pic.twitter.com/1R1Z4hriW8,1,real depression hour the
Quote of the day: &quot;Walk softly and carry a big magnifying glass.&quot;  -Richard Lacayo ,0,quote day quotwalk softly carry big magnifying glassquot richard lacayo
"Heey  twitter  ! im with my lil cousin  ,we are having so much fun! love her &lt;3",0,heey twitter im lil cousin we having fun love lt
"@amber_benson We all definitely need more up!  Down with down, have some more up, 7up, 1ups and fruit rollups. ",0,definitely need up down up up ups fruit rollups
"Went back to my normal style of poker, lost on monday but won last night. Still up for the week though ",0,went normal style poker lost monday won night week
about to leave for the kiro ,0,leave kiro
Depression has officially fully hit me  https://twitter.com/brooklynsessler/status/989227111373127680Â â¦,1,depression officially fully hit
"I Feel Like I've Been Distance From People Lately, I Have So Much Depression, I'm Always Tired, I Just With Sweatpants Most Of The Time, Stay Home All Day, Never Go Out, Unless School, I'm Bored, I Just Feel Like I...  https://www.facebook.com/angie9635/posts/1987482664609049Â â¦",1,feel like distance people lately depression tired just sweatpants time stay home day out unless school bored just feel like i
"@joshwellington Ditto. Ok, but I think i'm going with the V2 (sharper).  Big as you can make it. ",0,ditto ok think going v sharper big make it
almost 6 am...about time for bed ,0,amabout time bed
creating accounts all over the web ,0,creating account web
"Explosions and Boobs! www.explosionsandboobs.com Nothing more, nothing less! ",0,explosion boob com more le
So ready to play. ,0,ready play
"@ayanatheoracle @smallkewlhuman I'm glad you think that by quoting or telling me about someone doing research is going to be best for me. DEPRESSION IS DIFFERENT FOR EVERYONE. I don't know how hard that is to grasp. Just because  YOU THINK someone should handle depression your way, will not always work for them",1,glad think quoting telling doing research going best me depression different everyone not know hard grasp just think handle depression way not work
How Psychologists Treat The Kind Of Thinking That Leads To Depression by @drake_baer https://medium.com/thrive-global/how-psychologists-treat-the-kind-of-thinking-that-leads-to-depression-a690a0cebadeÂ â¦,1,psychologist treat kind thinking lead depression
Could 'one puff' of cannabis ease depression?  http://dlvr.it/QQjQSxÂ  pic.twitter.com/4HJlzVzMGW,1,one puff cannabis ease depression
@racheltoth deff over cigs ,0,deff cigs
@NathanMillson I so wanna hear about your hangover tomorrow ,0,wanna hear hangover tomorrow
More great evidence supporting daily exercise to create a more positive outlook: Exercising for 20 minutes-a-day cuts risk of developing depression by one third  https://www.telegraph.co.uk/science/2018/04/24/exercising-20-minutes-a-day-cuts-risk-developing-depression/?WT.mc_id=tmg_share_twÂ â¦ via @TelegraphSci,1,great evidence supporting daily exercise create positive outlook exercising minutesaday cut risk developing depression
@skratty007 fun! I'm really tired and sore from rehearsal but I had a great time ,0,fun really tired sore rehearsal great time
These 'What If's?' are killing you gradually. Save urself. See ahead of the darkness of the present into a new sunshine of future. #anxiety #depression #life #beautiful #mind #whatif #yqbaba #yqquotes Follow my writings on  https://www.yourquote.in/athoughtfulmindÂ  #yourquote via @YourQuoteApp pic.twitter.com/6A6ZfT61sE,1,what is killing gradually save urself ahead darkness present new sunshine future anxiety depression life beautiful mind whatif yqbaba yqquotes follow writing yourquote
Shoutout to depression naps lol,1,shoutout depression nap lol
"@Monica2112 Oh don't worry, I don't mind if you are.    I'm just happy u want to meet me!",0,oh not worry not mind are just happy u want meet me
Post graduate depression some sht,1,post graduate depression sht
Later at work! Money money money makes it funny ,0,later work money money money make funny
@bkwrrm_tx Hope you enjoy ,0,hope enjoy
"Dude, follow me - morning by the way  @Graciouskisay",0,dude follow morning way
Sleeping Pill UK â Most Affordable Cure for Insomnia & Depression  http://fancy.to/2xpve1Â  via @fancy,1,sleeping pill uk affordable cure insomnia depression
"When I was 21, I moved back to my parents home with depression and sadness filled me. I had very hard years to go through.",1,moved parent home depression sadness filled me hard year through
"@Caroline_S  I know, annoying to say the least. Anyhow.. the search continues! ",0,know annoying say least anyhow search continues
"@Andrewgoldstein i already did, it was on repeat for about two hours ",0,did repeat hour
"Omg same :(( for example, I won't know anyone and it's scary and 3 years of depression lmao  https://twitter.com/___parv/status/989213960372215808Â â¦",1,omg example not know scary year depression lmao
"@FaereWolf I won't go that far, but the depression lost again today. :D",1,not far depression lost today
"Mom's depression tied to kids' emotional, intellectual development  https://in.reuters.com/article/us-health-mothers-depression/moms-depression-tied-to-kids-emotional-intellectual-development-idINKBN1HW2MZÂ â¦  https://www.instagram.com/paulortegagonzalez20/?btz52=1915044625Â â¦",1,mom depression tied kid emotional intellectual development
"Why Us? Because Suicide, Depression and Addiction Aren't Selective...  http://thedirectiondiva.com/us-suicide-depression-addiction-arent-selective/?utm_source=ReviveOldPost&utm_medium=social&utm_campaign=ReviveOldPostÂ â¦ #MilitarySpouse #Success",1,u suicide depression addiction not selective militaryspouse success
@filmspotting welcome back to Iowa ,0,welcome iowa
"What will happen if I fall into depression, the fear of fear, the anxiety of anxiety - drop this idea and your death and your void consuming your life will disappear. Like water being absorbed into wood can break the largest stone into pieces, this idea can break your mind <Emoji: Brain>.",1,happen fall depression fear fear anxiety anxiety drop idea death void consuming life disappear like water absorbed wood break largest stone piece idea break mind emoji brain
"david archuleta and adam lambert are trending topics right now  .... yay, love them both!!!",0,david archuleta adam lambert trending topic right yay love both
@WilliamPromoter did you like terminator? ,0,did like terminator
Clinical depression is the # 1 global leading cause of disability.,1,clinical depression global leading cause disability
eatin' ice creamm ,0,eatin ice creamm
@Misikko &amp; @MissBlondie919 are doing a #giveaway. Enter to win a Corioliss flat iron on her blog! Good luck  http://is.gd/xuu5,0,amp doing giveaway enter win corioliss flat iron blog good luck
"@kayleenduhh OMG  the rap video hit 3,000 views! omg omg omg",0,omg rap video hit view omg omg omg
"I was technically an incel (hate that word) for years.My clinical depression, social anxiety and chronic shyness made damn sure nobody would be attracted to me.I am now happily married.Never killed anyone, though.",1,technically incel hate word yearsmy clinical depression social anxiety chronic shyness damn sure attracted mei happily marriednever killed anyone though
Fixed my specs ,0,fixed spec
"@MTVNews @kendricklamar Pulitzer Prize winner @KendrickLamar Talks About His #Depression and Suicidal Thoughts, and Music as Therapy  https://youtu.be/Hu4Pz9PjolIÂ  via @MTVnews #mentalhealth",1,pulitzer prize winner talk depression suicidal thought music therapy mentalhealth
Showaaa here I come!  Laterrrrzzzzzzzzzz. &lt;3,0,showaa come laterrzz lt
"I never question my depression anymore. Cuz I'll do that for a minute, then a really really Terrible day comes around n I wonder how I could've ever questioned.",1,question depression anymore cuz minute really really terrible day come n wonder questioned
Just finished running.  http://bit.ly/38lLd1  This picture is epic.,0,just finished running picture epic
