Text,Label,text_cleaned
@Bipolarstrong_ Together we can fight. I suffer with depression and am constantly reminded that I'm not good enough. Continue to be strong we are here for you.,1,fight suffer depression constantly reminded not good enough continue strong you
Sonic Mania Plus cured my depression,1,sonic mania plus cured depression
Surviving trauma doesn't mean there are no trace imprints still wreaking havoc  There are ways to cope & heal<Emoji: Heavy red heart><Emoji: Down pointing backhand index (medium dark skin tone)>#depression #anxiety #PTSD https://twitter.com/wearyourvoice/status/989127134278045696Â â¦,1,surviving trauma doe not mean trace imprint wreaking havoc way cope healemoji heavy red heartemoji pointing backhand index medium dark skin tone depression anxiety ptsd
My depression won't let me work out and be healthy  pic.twitter.com/OuPOJdCmyD,1,depression not let work healthy
Partying with Depression Turned My Life Upside Down  https://noisey.vice.com/en_us/article/gyydb3/partying-with-depression-feature-berlin?utm_campaign=sharebuttonÂ â¦,1,partying depression turned life upside
@E_Nicole LOL....Gosh...u are so right!!  ,0,lolgoshu right
"You gta love that cnt eat, cnt sleep feeling in your gut that makes your heart skip a beat ",0,gta love cnt eat cnt sleep feeling gut make heart skip beat
@rosie_g_yo http://twitpic.com/6acm2 - OooOo yay new makeups  I love that cute lil bag.,0,oo yay new makeup love cute lil bag
Finally off to bed after ipod took ages to load but now ready for my journey to bognor tomorrow ,0,finally bed ipod took age load ready journey bognor tomorrow
"@liannanshith for the roads, right? That and the mountains. ",0,road right mountain
@Rorzshach I've moved school before...it's not that bad really ,0,moved school beforeit not bad really
"Fuck depression, it should honestly just kill itself already",1,fuck depression honestly just kill
"@stefanie_go AHH! vampire! haha, you ain't that pale naman ah ",0,ahh vampire haha ai not pale naman ah
@LizJonasHQ he does? that's awesooooooooomeeeee  ..but how do you knwo it's true??,0,doe awesoomee but knwo true
still need to find out the code to get into the outdoor pool which is finally done! heading to the store to get sandwich stuff 4 lunch ,0,need code outdoor pool finally done heading store sandwich stuff lunch
photo's done. off to graphics. long. long day  nite.,0,photo done graphic long long day nite
@ecccoautist @RemyVampVuitton Low priority sectionCurb depressionGo to rehabAcknowledge that your behavior is a sign of oncoming societal collapse and another dark ages,1,low priority sectioncurb depressiongo rehabacknowledge behavior sign oncoming societal collapse dark age
The day that I over come my depression will literally be the best day,1,day come depression literally best day
Lose your #anger #anxiety #insecurity and #depression through #meditation #Buddha via @moodcards pic.twitter.com/K5kHydrKVJ,1,lose anger anxiety insecurity depression meditation buddha
"I consider myself to be a very strong minded individual. I've gone to my lowest point & idk how others would Handle it. I would hate for ppl to go through depression, anxiety or any other mental issue alone",1,consider strong minded individual gone lowest point idk handle it hate ppl depression anxiety mental issue
Reading this helped me. Maybe good for Japanese friends struggling with anxiety or depression.  https://twitter.com/sheepchase/status/988951764106821632Â â¦,1,reading helped me maybe good japanese friend struggling anxiety depression
Being a hobo on the floor with Mikey ,0,hobo floor mikey
Going to see UP tonight... yay  I love movie nights with the boytoy &lt;3,0,going tonight yay love movie night boytoy lt
I'm always searching for ways to encourage myself. I never heard this song it is beautiful! I dedicate this to all who struggle with depression!  https://www.youtube.com/attribution_link?a=K_wJljuT7as&u=%2Fwatch%3Fv%3D3b3TqoE7te4%26feature%3DshareÂ â¦,1,searching way encourage myself heard song beautiful dedicate struggle depression
"@greeneash http://twitpic.com/6rrtf - awww, this pic is cute ",0,aww pic cute
just saw hangover funniest movie i have seen in awhile! highly recommened ,0,just saw hangover funniest movie seen awhile highly recommened
Had some great cookies now going to bed ,0,great cooky going bed
"@justlikeanovel You like life like a novel, all tangled up   Just write, I'd like to read more of your work and thoughts",0,like life like novel tangled just write like read work thought
"I think I would know what depression is. And quite rarely do I slump into a paralyzed state where I want to be in a dark room away from anybody else. But every few weeks or so, I would wake up in the morning and nothing seems right.",1,think know depression is quite rarely slump paralyzed state want dark room away anybody else week so wake morning right
I've been sleeping late again. And a bit of depression is creeping again.  I just hope it won't be another episode. #worried,1,sleeping late again bit depression creeping again just hope not episode worried
Sooo excited!! Headed to the opera  with friends... &quot;Tosca&quot; a tragedy ... But what opera's not one lol,0,soo excited headed opera friend quottoscaquot tragedy opera not lol
"@AROD5005 Thank u for the well wishes in regards to my day at the beach. We had a great time, and I got  several shades darker ",0,thank u wish regard day beach great time got shade darker
Went to &quot;Let's Be Frank&quot; today. I enjoy the idea and I support them ,0,went quotlet frankquot today enjoy idea support
@peetahuja looking at a waterfall wont cure my crushing depression or my zero self worth or my crippling social anxiety <Emoji: Smirking face><Emoji: Smirking face><Emoji: Smirking face>,1,looking waterfall wont cure crushing depression zero self worth crippling social anxiety emoji smirking faceemoji smirking faceemoji smirking face
"@davedawes and @slboval  Yeah I think playing the game alone, after a wknd like that = dangerous!! ",0,yeah think playing game alone wknd like dangerous
@mileycyrus its true that all you need is love but sometimes you have to think about if your getting love from the right person  x,0,true need love think getting love right person x
Oh no my depression! *bends over seductively to pick up depression**bends over seductively to pick up depression*,1,oh depression bend seductively pick depressionbends seductively pick depression
@JasonJMikeMgmt  just makin sure you're alive    Ur silent today!  Just sayin Hey!!  See how I miss you????  ,0,just makin sure alive ur silent today just sayin hey miss you
My 6 year old just asked me why her teacher is &quot;Following&quot; me on MySpacebook.  LOL,0,year old just asked teacher quotfollowingquot myspacebook lol
The #Whistling Cure ,1,whistling cure
I get the Best of Both Worlds....literally! lol ,0,best worldsliterally lol
going<Emoji: Airplane>early depression hours,1,goingemoji airplaneearly depression hour
Good morning ppl  Hoping to get rid of this Monday morning feeling!,0,good morning ppl hoping rid monday morning feeling
"Save the date! On May 3 at 3 PM ET, join @NIMHgov for a Twitter chat on teendepression. NIMH experts will be on hand to answer your questions. Use#NIMHchats to follow the conversation:  http://bit.ly/2K3W5hJÂ  pic.twitter.com/fYDqzvco2T",1,save date pm et join twitter chat teendepression nimh expert hand answer question use nimhchats follow conversation
I love Lauren so much <Emoji: Loudly crying face><Emoji: Loudly crying face><Emoji: Heavy red heart><Emoji: Heavy red heart> she has helped me threw depression and anxiety and the hardest times with family an friends <Emoji: Smiling face with halo> @Lauren_Daigle  thanks so much for everything pic.twitter.com/c6jSsmCfFX,1,love lauren emoji loudly cry faceemoji loudly cry faceemoji heavy red heartemoji heavy red heart helped threw depression anxiety hardest time family friend emoji smiling face halo thanks
Every time I think my depression is going away for good I look at Twitter and am immediately brought right back,1,time think depression going away good look twitter immediately brought right
Now time to head to a radio interview... This will be an exciting one ,0,time head radio interview exciting
Its ok not to be ok #Depression #MentalHealth #LoveLife #WorkHard #Smile #Happy #beautifulLife #LoveLife #Goals #KeepOnTrying #SummerIsComing,1,ok not ok depression mentalhealth lovelife workhard smile happy beautifullife lovelife goal keepontrying summeriscoming
Funny how depression can be cool,1,funny depression cool
"@sockington I dont care what hoomans call me, as long as its not &quot;late for dinner&quot;!  No food, I get cranky, murder cranky... right? ",0,dont care hoomans me long not quotlate dinnerquot food cranky murder cranky right
"Analysis of 2,000 millennials found that the chance of experiencing depression or anxiety among those who reported feeling lonely more than doubled.   http://ow.ly/6H1p30jFlViÂ ",1,analysis millennials chance experiencing depression anxiety reported feeling lonely doubled
"Should Mothers Avoid Nighttime Breastfeeding to Decrease Their Risk of Depression. Free handout, share and print.  http://ow.ly/Le9P30jf99GÂ  #breastfeeding #nursing #sleep #mother #baby",1,mother avoid nighttime breastfeeding decrease risk depression free handout share print breastfeeding nursing sleep mother baby
"@nintendolife At first glance, I thought it said 'crippling depression'",1,glance thought said crippling depression
Wow hi again depression,1,wow hi depression
Off to take a shower and get ready for work. Again...lol Yay! more money to go back to school in September ,0,shower ready work againlol yay money school september
New personal one-legged squat record of 10 whoot whoot ,0,new personal onelegged squat record whoot whoot
"Btw, watching funny videos when sitting in a library .... big no-no!! ",0,btw watching funny video sitting library big nono
Nothing better than a day in the sun. ,0,better day sun
IM BORED AND TRYING TO STAVE OFF DEPRESSION BY MAKING U DO THIS BUT ALSO U ONLY HAVE TO DO LIKE ONE,1,im bored trying stave depression making u u like
Hi I just wanted to share with everyone a song that sends me into a deep depression  https://open.spotify.com/track/3BKp3p9HF9nMP4CcSsOBAf?si=iUqOIcGVQTSeE47MQV90dwÂ â¦,1,hi just wanted share song sends deep depression
it's depression nap o'clock !!,1,depression nap oclock
The reason I was M.I.A for 3 or 4 mouth because I was going through a lot of things basically I was short of in a depression state of mind. What maid even worst is nobody never check up on me.,1,reason mia mouth going lot thing basically short depression state mind maid worst check me
Holy shit! I saw a tornado today &amp; I got some SWEET pictures of it from the roof. I've always wanted to see a tornado. It was awesome! ,0,holy shit saw tornado today amp got sweet picture roof wanted tornado awesome
Bom dia twittes! ,0,bom dia twittes
"welll, ie got people to go to town with   let me know if your gna come DDDD",0,well got people town let know gna come dd
Kanye West loses 9M followers in a day for liking Trump. I lose 2 followers for not liking #Trump and I spiral into depression <Emoji: Face with tears of joy> Guess its all relative!,1,kanye west loses m follower day liking trump lose follower not liking trump spiral depression emoji face tear joy guess relative
http://twitpic.com/6bmgw - Last one from today. Its just so beautiful in person ,0,today just beautiful person
bruce willis is a mofuckin bamf ,0,bruce willis mofuckin bamf
"lmaooo i posted my story on instagram and it mentions my depression.. one chick that doesn't follow me liked it but the gag is, she harassed me and threatened to beat me up over a party freshman year, contributing to my depression <Emoji: Face with tears of joy>",1,lmaoo posted story instagram mention depression chick doe not follow liked gag is harassed threatened beat party freshman year contributing depression emoji face tear joy
"No Depression by G Herbo is my mood from now on, i'm done stressing over people that don't deserve it",1,depression g herbo mood on stressing people not deserve
"<Emoji: Smiling face with sunglasses>'Before you diagnose yourself with depression or low self-esteem, first make sure you are not, in fact, just surrounded by assholes.' ~W. Gibson #quotes #WednesdayWisdom #WednesdayMotivation #InspirationalQuotes",1,emoji smiling face sunglassesbefore diagnose depression low selfesteem make sure not fact just surrounded asshole w gibson quote wednesdaywisdom wednesdaymotivation inspirationalquotes
"It's kinda funny seeing how you react about MH issue when in fact, you are one of the reasons why I've been going through this anxiety/depression.",1,kinda funny seeing react mh issue fact reason going anxietydepression
"I ain't stressin, bitch ain't no depression",1,ai not stressin bitch ai not depression
he told us he was diagnosed with depression some years ago and that he goes to a therapist and he was telling us so many kind words,1,told diagnosed depression year ago go therapist telling kind word
#liesgirlstell yea babii i luv u long time ,0,liesgirlstell yea babii luv u long time
@vernontrent tis what he told me in palm springs. hope he does well there. ,0,ti told palm spring hope doe there
Anxiety mixed with depression is the worst <Emoji: Persevering face>,1,anxiety mixed depression worst emoji persevering face
Playing the wii and guitar lol and wrks in few hrs ,0,playing wii guitar lol wrks hr
Low-functioning depression mode. <Emoji: Woman tipping hand (light skin tone)>,1,lowfunctioning depression mode emoji woman tipping hand light skin tone
"I got the cuddles and besitos I wanted, yet my ass is still sad. Damn, depression is wild <Emoji: Sneezing face>",1,got cuddle besitos wanted as sad damn depression wild emoji sneezing face
#RantsAndRaves Re: I hate people that... : Thank you for the laugh   ------------------------.. http://chilp.it/?482237,0,rantsandraves re hate people that thank laugh
@fureousangel  I recently did a Matrix Trilogy sitting..that was tiring but awesome (Matrix Trilogy is my favorite sci fi film story) ,0,recently did matrix trilogy sittingthat tiring awesome matrix trilogy favorite sci fi film story
@jasongardiner love you  soon?!?,0,love soon
Exercise and Depression: How Sweating Is Good for Your Mental Health  https://ift.tt/2Hwqu73Â ,1,exercise depression sweating good mental health
The Isolation Cycle of Depression and Anxiety  http://bit.ly/2rM5AgCÂ  pic.twitter.com/6VpM63ypzI,1,isolation cycle depression anxiety
"To show you the power of SUDDEN DEPRESSION, I SAWED THIS BOAT IN HALF!",1,power sudden depression sawed boat half
The only reason why it's raining is because my depression has come back out of the shadows lol,1,reason raining depression come shadow lol
Happy late morning (my time) everyone! ,0,happy late morning my time everyone
Depression & Obsession // Xxxtentaction,1,depression obsession xxtentaction
"@UncleRUSH  Hey Russell, did you see my Christ and Yoga rap video?",0,hey russell did christ yoga rap video
"@bahree Can't be any worse than those humongous HTC things you used to have. ;)  Besides, no-one ever calls me so it's a moot point. ",0,ca not worse humongous htc thing used have besides noone call moot point
@terez07 I am right there with you. I really wish I had some ice cream right now!  http://twitter.com/terez07/status/1975059961,0,right you really wish ice cream right now
"Just one puff of #cannabis 'could ease #depression, #stress and #anxiety' https://www.thesun.co.uk/news/6137739/cannabis-ease-depression-stress-anxiety/Â â¦",1,just puff cannabis could ease depression stress anxiety
@breatheagain Things are good. Trying to get LoveBetterCamp.com up and running. Hotwings in the oven ,0,thing good trying lovebettercampcom running hotwings oven
@capsontwittter Yeah.  I don't know where. :| ))),0,yeah not know where
@devilishdelish enjoy B  ,0,enjoy b
"still waiting for 30 followers, any helpers out there? please ",0,waiting follower helper there
"#ë°ë´ì ë°ë´ë²ë ¤ëì¸ì its been 4 years since people started hating Bom for taking medicines for her depression, you cant compare her to a serial killer she was doing nothing but taking care of her mental health!!! She did nothing wrong",1,year people started hating bom taking medicine depression compare serial killer doing taking care mental health did wrong
"There is no drug for intellectual depression...Okay, maybe there is.",1,drug intellectual depressionokay maybe is
Can somebody please get these done soon? is tomorrow ok?  &quot;New aircraft seat design ideas shown&quot; http://ping.fm/Hnuv5 (via @Plane_Talking),0,somebody soon tomorrow ok quotnew aircraft seat design idea shownquot via
JK Rowling has magical words for Harry Potter fan suffering from depression (12 Photos)  http://thechive.com/2018/03/22/jk-rowling-has-magical-words-for-harry-potter-fan-suffering-from-depression-12-photos/Â â¦,1,jk rowling magical word harry potter fan suffering depression photo
@MarvelStudios @Marvel WHYYYYYYY??? Depression level 100 #InfinityWar #Serbian,1,whyy depression level infinitywar serbian
ASMR cooking videos cured my depression,1,asmr cooking video cured depression
I'm calling your room-mate!!!  ,0,calling roommate
Just got homeeeee whaaaatsss goodddd???? ,0,just got homee whaatss goodd
Morning tweets! Devils won after OT their 2nd... ,0,morning tweet devil won ot nd
"@EviLovesMcFly we start our summer sme day after next week  nd lol use have bril weather,id love to b in germany for winter(wuld b bril)",0,start summer sme day week nd lol use bril weatherid love b germany winterwuld b bril
"@nyxrising Inquisition all the way because I relate to some of the characters so much. Also this game helped me though some major depression, it helped me to push some really dark times in my life",1,inquisition way relate character much game helped major depression helped push really dark time life
@KenaSiu Hey thanks!! ,0,hey thanks
@meofthesea It's how depression works for a lot of ppl :(,1,depression work lot ppl
"@elicab Aw. Well if u ever feel like flying over 2 con it up i'll help u find a place 2 crash... I once flew 2 London 4 a Buffy con, btw. ",0,aw u feel like flying help u place crash flew london buffy con btw
My mother is the biggest part of my depression and all she does is push me everyday closer and closer to the edge <Emoji: Unamused face>,1,mother biggest depression doe push everyday closer closer edge emoji unamused face
@bubblewrap_x Hmmm not sometimes......Well ALL THE TIME ,0,hmm not sometimeswell time
@sweetiemiley i ove your rolling stones shirt at mitchell mussos concert ,0,ove rolling stone shirt mitchell mussos concert
@audball_xo Totally agree with you on Beyonce. She's stupid. (: Ali Larter is WHERE IT'S AT! ,0,totally agree beyonce stupid ali larter it at
woohoo! just bought me a twilight and joker poster ,0,woohoo just bought twilight joker poster
@TMobile_Chris I just mean I had a few too many  owww... my head.,0,just mean oww head
has post from Logical Awesome! It's an envelope full of Github stickers! Yay! ,0,post logical awesome envelope github sticker yay
on my way to the V to see ma fam bam!..tryna stay busy..doin good 2day ,0,way v ma fam bamtryna stay busydoin good day
i am going to sleep. just created an account here ,0,going sleep just created account
is going to get contact lenses... hopefully ,0,going contact lens hopefully
"@caitlinmoran To others. That's been 18 months of counselling(so far) and a direct result of that (still embryonic) discovery, I've started to properly deal with the depression and anxiety which has blighted my life and relationships for twenty five years. It's hard work, but will be worth it",1,others month counsellingso far direct result still embryonic discovery started properly deal depression anxiety blighted life relationship year hard work worth
@EthanSuplee How come we never ever see her face? ,0,come face
Why Adolescence Makes Teens Vulnerable to Depression by Jeff Nalin  https://mental-health-matters.com/why-adolescence-makes-teens-vulnerable-to-depression/Â â¦,1,adolescence make teen vulnerable depression jeff nalin
Maybe depression is right. Maybe it really would be better if I had never been born.,1,maybe depression right maybe really better born
Depression is the hell inside of me and it eats me up daily.,1,depression hell inside eats daily
#follow naijasdime I am trying to get my own trending topic ,0,follow naijasdime trying trending topic
@XennyBrown aw comeon u knew i was more coloured then you didn't you ,0,aw comeon u knew coloured did not
Good Night Twitterlers. I'm off to DreamLand with the positive outlook that I will finish all my schoolWork by Sunday night. ,0,good night twitterlers dreamland positive outlook finish schoolwork sunday night
Thor's family drama is the reason I have depression,1,thor family drama reason depression
"is it normal to have or having a feeling like """"""""postpartum depression""""""""? or am i jst emosh!t!?! <Emoji: Slightly frowning face><Emoji: Disappointed but relieved face> â feeling worried""""",1,normal having feeling like postpartum depression jst emosht emoji slightly frowning faceemoji disappointed relieved face feeling worried
"@benjaminbirdsng -- Hey Ben, Its David Berrys daughter Breana from South Boston! Keep in touch!  Love you guys! Yall did great.",0,hey ben david berry daughter breana south boston touch love guy yall did great
@omgitschelsea aww thanks girl ,0,aww thanks girl
Stick with Autism Help Acting On Depression,1,stick autism help acting depression
"my depression, anxiety, and loneliness fighting over who is gonna take over me next...  pic.twitter.com/oj1iMktFr7",1,depression anxiety loneliness fighting gonna next
@sids anytime mate ,0,anytime mate
@MamaCitaa_ awww poor thing...lol oh okay hopefully u dont give me a virus....Hahaha! ummm.its 3:56am  yup yup usa bby!!!!,0,aww poor thinglol oh okay hopefully u dont virushahaha ummits am yup yup usa bby
"@stillgenie I thought that was the show she casts. I want to be the star, or nothing. ",0,thought cast want star nothing
"Mom's depression tied to kids' emotional, intellectual development  http://dlvr.it/QQnfrWÂ ",1,mom depression tied kid emotional intellectual development
@jimmyfallon #MySuperpower would be anti depression,1,mysuperpower anti depression
I don't think people realize that depression is a real thing and how serious it is...,1,not think people realize depression real thing is
"@marramgrass Personally, I prefer snow ",0,personally prefer snow
1st Wedding Anniversary today   Here's to many more blissfully happy years together.,0,st wedding anniversary today blissfully happy year together
"Forgot to say that the police were called to the wedding (outdoors, music, go figure). All the best parties, eh? ",0,forgot say police called wedding outdoors music figure best party eh
@ellamorton cool! wish you luck. and hope the rain doesn't dampen your mood. ,0,cool wish luck hope rain doe not dampen mood
My depression and anxiety vlog  https://youtu.be/VEpZ8Js7h2MÂ  via @YouTube,1,depression anxiety vlog
"She definitely showed signs of alcoholism, but it was potentially triggered by her suffering from Postpartum Depression.",1,definitely showed sign alcoholism potentially triggered suffering postpartum depression
about how youre not weak if you have depression/anxiety or if you go to a therapist and that its a part of your great journey :(,1,youre not weak depressionanxiety therapist great journey
Okay Good Knight Twitter World Hubby time ,0,okay good knight twitter world hubby time
in a threesome with anxiety and depression,1,threesome anxiety depression
Going to the #cubs game on a beauuutiful afternoon for baseball ,0,going cub game beauutiful afternoon baseball
i certainly do enjoy havimg depression :),1,certainly enjoy havimg depression
"Recently fallen off waking up and going for a run everyday. I've let the anxiety & depression take the wheel. While sitting in my thoughts @ZacharyLevi tweet response popped in about how great exercise is for anxiety and mental well being. So I got up and ran, I ran so far away.",1,recently fallen waking going run everyday let anxiety depression wheel sitting thought tweet response popped great exercise anxiety mental being got ran ran far away
"scope_phill thank you  i do model, for playboy.",0,scopephill thank model playboy
this movie just worsened my depression tbh :) i wanna die :)  pic.twitter.com/fygUwhvYNh,1,movie just worsened depression tbh wanna die
Can i go to your school? What are the requirements other than peer pressure and anxiety followed by depression?  https://twitter.com/aJackieLarsen/status/988820882717003776Â â¦,1,school requirement peer pressure anxiety followed depression
"The Oil that has the Potential to Fight Migraines, Depression, Anxiety, & Even Cancer  http://www.healthy-holistic-living.com/oil-potential-cure-migraines-depression-anxiety-even-cancer.htmlÂ â¦",1,oil potential fight migraine depression anxiety cancer
"I used to live there. I had to battle for back operation for 5 years, as they said it was depression that was causing 24/7  muscle spasms. Eventually, I got them to do it, and they discovered my body was rejecting spinal rods, inserted when I was 9.  https://twitter.com/scrowder/status/989176926785884161Â â¦",1,used live there battle operation year said depression causing muscle spasm eventually got it discovered body rejecting spinal rod inserted
"We didn't get home, though, until nearly midnight, so I went straight to bed. ",0,did not home though nearly midnight went straight bed
