Text,Label,text_cleaned
"when something is already stressing you out to the point it's literally triggering your depression/anxiety to go full force on you yet someone wont stop bringing up the stressful situation, making things worse & more overwhelming then it already is  pic.twitter.com/PVb6IG1FKm",1,stressing point literally triggering depressionanxiety force wont stop bringing stressful situation making thing worse overwhelming
back to do drawing exercise THEN sleep ,0,drawing exercise sleep
@wizbiff Thank you for posting the LGT site! ,0,thank posting lgt site
Morning all! Feeling great this morning. Probably something to do with the weather and the fact it is Friday!  TGIF,0,morning all feeling great morning probably weather fact friday tgif
Anyone have any resources for me re depression and intuition? Specifically nourishing your intuition while learning which thoughts are the depression?,1,resource depression intuition specifically nourishing intuition learning thought depression
"Depression is real,cant begin to describe how I've been feeling this past  http://week.ItÂ  comes from nowhere & wants to stay.",1,depression realcant begin feeling past come want stay
"http://twitpic.com/6gblh - This is my new desktop. @majornelson, you'll like it ",0,new desktop like
"Themes revolved around tragedy, death, anxiety, depression, suicide, tough relationships, and other issues that are so very relevant, so very current.",1,theme revolved tragedy death anxiety depression suicide tough relationship issue relevant current
@colossalblue Nah that's the one I meant ,0,nah meant
"@bitprophet ooh, thanks for the heads up ",0,ooh thanks head
"@PhantomPen Yah, weird. Real glad you're back. Now - STAY! ",0,yah weird real glad back stay
@Londonspirate Oooo good tip! hello by the way ,0,oo good tip hello way
"I like the idea of college in theory. Other than the shit grades, depression, debt, and competitiveness shit's lit.",1,like idea college theory shit grade depression debt competitiveness shit lit
"And on the other side of spectrum, if you descend into chaos, depression, lose grip on your life, lose your work ethic, no matter how you try, how much effort you think you're putting, things seem to never work out",1,spectrum descend chaos depression lose grip life lose work ethic matter try effort think putting thing work
@MLescaut  Danke  *freu*,0,danke freu
"That free Ericsson laptop hoax email is doing the rounds again. Now somebody have a face full of eggs, courtesy of the local BOFH ",0,free ericsson laptop hoax email doing round again somebody face egg courtesy local bofh
"Our team is proud to be involved in @tandemcopd, we are here today hearing recent updatesOptimising the benefits of #pulmonaryrehab by aiming to reduce anxiety & depression",1,team proud involved today hearing recent updatesoptimising benefit pulmonaryrehab aiming reduce anxiety depression
"@amandabynes i really liked it! i'm ur #1 fan i loved all of ur movies! especially 'she's the man', it's so funny! I LOVE IT!  &lt;3",0,really liked it ur fan loved ur movie especially ishe man funny love it lt
@holton29 I know   Now fix my iphone lol,0,know fix iphone lol
All I can say is Depression sucks!! #mentalhealth,1,say depression suck mentalhealth
1-800-273-8255 - suicide hotline877-226-3111 - addiction hotline844-228-2962 - eating disorder hotline877-455-0628 - self harm hotline888-640-5174 - depression hotlinemy dms - lonely thots hotlineshare this for someone who might really need these phone numbers,1,suicide hotline addiction hotline eating disorder hotline self harm hotline depression hotlinemy dm lonely thots hotlineshare really need phone number
me after the most minor inconvenience convincing myself weed cures depression & will fix everything  pic.twitter.com/snxpAkBPWM,1,minor inconvenience convincing weed cure depression fix
@realDonaldTrump SYMPTOMS OF PREMENSTRUAL SYNDROMEThe symptoms that we associate with PMS vary but include :â tensionâ irritabilityâ depression........More <Emoji: Down pointing backhand index><Emoji: Down pointing backhand index> https://mylifestylecrunch.com/2018/03/28/premenstrual-syndrome-pain-before-periods/Â â¦,1,symptom premenstrual syndromethe symptom associate pm vary include tension irritability depressionmore emoji pointing backhand indexemoji pointing backhand index
you know. tracks that will change your life ,0,know track change life
"I had to stop what I was doing to go pick up a bed for my visiting mother in law.    I'm back!  Let's see, where was I?",0,stop doing pick bed visiting mother law back let see i
"Check out Heart Of Love Evolution: Surviving #Depression  http://amzn.to/2spiFNmÂ  Depression is the giving up of hope, the belief that no one cares for you, and the thought that suicide is the only way out #yeg #yyc #yvr",1,check heart love evolution surviving depression depression giving hope belief care you thought suicide way yeg yyc yvr
Woohoo.. The Da Vinci Code on Pro7 this evening  #OTR,0,woohoo da vinci code pro evening otr
Ooooo... what a change! ,0,oo change
@guineapig66 I can relate to the inertia caused by depression.  I think I've lost 3+ months this year due to meds which made me so groggy/sleepy all the time that I couldn't write at all - or read Add pain to that & you get a rabid zombie lol! I managed to edit quite a bit this weekend tho.,1,relate inertia caused depression think lost month year med groggysleepy time not write read add pain rabid zombie lol managed edit quite bit weekend tho
"Molestation, Attempted suicide twice , YALL DEPRESSION <Emoji: Loudly crying face>. Do not live your life according to someone else's plan, Don't seek validation from people who mean you no good or don't even truly care about you. Understand that your hardships can not BREAK KILL OR STEAL",1,molestation attempted suicide twice yall depression emoji loudly cry face not live life according plan not seek validation people mean good not truly care you understand hardship not break kill steal
Lifestyle factors and the course of depression in older adults: A NESDO study:  https://onlinelibrary.wiley.com/doi/abs/10.1002/gps.4889?af=RÂ â¦ via 360 medics,1,lifestyle factor course depression older adult nesdo study medic
"I guess it's meant to be, you and this depression lonely together forever.",1,guess meant be depression lonely forever
@_TASOfficial_ I really miss XYZ since 2016 i have Post anime depression and its the most longest pads i ever have. :<,1,really miss xyz post anime depression longest pad have
@michaelflux wont get passed the king of revers engineering shots  lol,0,wont passed king revers engineering shot lol
"you can cure bipolar depression by eating fruits, going to the gym, and discovering what YOU'RE doing wrong â a dumbass w a no-name online degree in holistic medicine",1,cure bipolar depression eating fruit going gym discovering youre doing wrong dumbass w noname online degree holistic medicine
Look at the cute hat I got today...I look scary but my hat is cute  http://twitpic.com/6e1p9,0,look cute hat got todayi look scary hat cute
@s4r4hj I know! already looking online to see what I'm after! Lol! ,0,know looking online after lol
Diggin mah new sweater ,0,diggin mah new sweater
"@FRANKTRIGG  And if the heat doesn't get you, watch out for those crazed Disney fanatics ",0,heat doe not you watch crazed disney fanatic
"myra gave me dis cute pink bracelet for my burfday.  thnks, gal. apreciate it. a lot ",0,myra gave dis cute pink bracelet burfday thnks gal apreciate it lot
"I edited over 400 photos, blogged ( http://tr.im/funnyface ), and took care of some emails.  If only I was this productive all the time. ",0,edited photo blogged took care email productive time
"Leaving for a week at Bonnaroo in Manchester, TN. Music, art, and camping....and humidty ",0,leaving week bonnaroo manchester tn music art campingand humidty
"Whether you are excited to graduate or nervous to be on your own, post-graduation depression is coming, and you might be its next target. Find out what you can do to avoid it here:  http://www.dixiesunnews.com/news/articles/2018/04/24/post-graduation-depression-palpable-dsu-alumni/Â â¦",1,excited graduate nervous own postgraduation depression coming target avoid here
"Psa: if you call someone struggling with depression, anxiety, etc. crazy, you are a piece of crap!!",1,psa struggling depression anxiety etc crazy piece crap
"So i would just like to end all my social media, due to the post depression that Infinity War gave me. Move out (joke onli)",1,just like end social medium post depression infinity war gave me joke onli
I left Facebook November 2017 and took a long break because of my mental health was my top priority I was diagnosed with suicidal depression 12 years ago because of what happened to me,1,left facebook november took long break mental health priority diagnosed suicidal depression year ago happened
good luck nlang sa iv-e... hahahaha.. bago toh.. ngaion lang aq lilipat ng classroom... MEANT to be talaga kme... hahahahah.. ,0,good luck nlang sa ive hahahaha bago toh ngaion lang aq lilipat ng classroom meant talaga kme hahahahah
"@wine_sport @AntiGOPActivist @EnriqueMFlores3 @otepofficial @SassyMsViolet @MamaRose2017 @KalelVX @dawnresist @SagArcher @KalenaAnna Kalena,I am so sorry u had a stroke!I have had several TIAs without lasting disabilities,Thank God. Being a retired RN I understand just how close we both are n having life threatening events.Don't give up hope & don't give in to depression, it can cloud ur perception,Wish u Best",1,kalenai sorry u strokei tia lasting disabilitiesthank god retired rn understand just close n having life threatening eventsdo not hope not depression cloud ur perceptionwish u best
@YoungQ I have made several close friends because of NKOTB!!! It's a beautiful thing!!!!! ,0,close friend nkotb beautiful thing
@Andy_Allen  Lol. def my kind of gardening too - reclining on couch whilst organising the activity with other people's arms and legs. ,0,lol def kind gardening reclining couch whilst organising activity people arm leg
i need my depression to chill a bit cause i havet done any art in over a month wtf,1,need depression chill bit cause havet art month wtf
@sadieefacee Good things come to those who meet ,0,good thing come meet
beat my meat n then my depression,1,beat meat n depression
"who couldnt afford the bus, got rIPPED OFF, got into a car accident, suffering from depression and anxiety,",1,afford bus got ripped off got car accident suffering depression anxiety
@evercode Think of it as &quot;how many times you have ridden the earth around the sun&quot; getting older = honor - like I ridden it more than you ,0,think quothow time ridden earth sunquot getting older honor like ridden
Either I have a smidge of depression OR I've hit that lost 20s phase,1,smidge depression hit lost s phase
Depression is having an anime club at your school,1,depression having anime club school
depression is being lonely in a room full of peopledepression is being constantly tired but never able to sleepdepression is smiling to hide the pain insidedepression is when the soul dies but the body keeps on goingdepression is forgetting who you used to be,1,depression lonely room peopledepression constantly tired able sleepdepression smiling hide pain insidedepression soul dy body keep goingdepression forgetting used
FINALLY got my heels for grad.  ,0,finally got heel grad
i cooked. depression where?,1,cooked depression where
@JudithLewis Excellent! Glad to hear there was now weirdness ,0,excellent glad hear weirdness
"@anjelahjohnson Tried to buy tickets for May 5th in Brea, but StubHub bought them all and charging over 3x the price. My friend is a social worker and said she was battling depression and I really wanted to bring her to laugh together, but on our salaries, can't do it.  pic.twitter.com/RCxOC5g0kX",1,tried buy ticket th brea stubhub bought charging x price friend social worker said battling depression really wanted bring laugh together salary it
@chxnguye haha yeah ! of course I watch Twilight ! haha. I love ALL the books haha. ! ,0,haha yeah course watch twilight haha love book haha
@dirtyrottengoss wat !!! omg that's awsom ,0,wat omg awsom
Women struggling to get pregnant have elevated anxiety and depression levels similar to women with heart disease and cancer.  https://www.huffingtonpost.com/entry/opinion-merrill-ivf-failure_us_5adf8637e4b061c0bfa27b19?ncid=engmodushpmg00000004Â â¦ via @HuffPost,1,woman struggling pregnant elevated anxiety depression level similar woman heart disease cancer
@ASinisterDuck i will join dunno if you added me ,0,join dunno added
There are so many puppies being walked along the boardwalk.  And my cousin Ian must pet each one.  He's 23.  ,0,puppy walked boardwalk cousin ian pet one
@selenagomez I LOVED that movie!!! Zac is awesomeee ,0,loved movie zac awesomee
"@mrjb3  wow 7 years, you would need to like it after that. Stress is good in short bursts keeps you alive ",0,wow year need like that stress good short burst keep alive
@koriannespeaks I plan on going. ,0,plan going
"@vmlemon University of The West of Scotland here  We just merged with Bell Collage last year. Same ,all over the place",0,university west scotland just merged bell collage year all place
Reminiscing... this used to be my street corner... read this poem on the wall every day  http://bit.ly/fHuA7,0,reminiscing used street corner read poem wall day
"Physical Activity and Incident Depression: A Meta-Analysis of Prospective Cohort Studies: American Journal of Psychiatry: Vol 0, No 0  https://ajp.psychiatryonline.org/doi/suppl/10.1176/appi.ajp.2018.17111194?platform=hootsuite#.WuBj1x0CpLE.twitterÂ â¦",1,physical activity incident depression metaanalysis prospective cohort study american journal psychiatry vol
 smiling.everyone should try it.,0,smilingeveryone try it
hey to my new followers - come over and introduce yourselves ,0,hey new follower come introduce
me during the depression hours crying over my faves vs me when i wake up  pic.twitter.com/V3qCYmDHaT,1,depression hour cry faves v wake
"@Jawslyn @butterynipple thanks babes for the concern, me feel loved  i'll be going for a scan for my heart, hope it's ok...",0,thanks babe concern feel loved going scan heart hope ok
@infinitekris great minds think alike ,0,great mind think alike
Today is Thunder Over Louisville - the start of the Derby Festival.  I love being here for the festivities even if I'm not going.  ,0,today thunder louisville start derby festival love festivity not going
is new here... ,0,new here
. I'm gonna take my depression nap for three more days. I worked too hard for this. I hate it. Bye....Also plz don't pm me I never reply  pic.twitter.com/0435xCwpc2,1,gonna depression nap day worked hard this hate it byealso plz not pm reply
just started today ,0,just started today
@survivor91 ummm like 200 votes pwease???? ,0,umm like vote pwease
Thank you Melissa for all of your support in life and for believing in the things I do. I would be lost most of the time if not for you. ,0,thank melissa support life believing thing do lost time not you
Depression is literally the biggest bitch,1,depression literally biggest bitch
There is a difference between being anxious every once in a while and having anxiety. There is a difference in being sad and depression. If you do not know the difference go read a book before you open your mouth and try to tell someone to get over it.,1,difference anxious having anxiety difference sad depression not know difference read book open mouth try tell it
Just got a big wave of depression at work and I have a date with a girl tonight. #prayforme <Emoji: Face with cold sweat><Emoji: Person with folded hands (light skin tone)>,1,just got big wave depression work date girl tonight prayforme emoji face cold sweatemoji person folded hand light skin tone
@shashee I was in a board meeting all day and just got into my room from IHOP ... Had to check in on my tweeps ,0,board meeting day just got room ihop check tweeps
@skatagb @bitchywolfhard Oh my god youre right<Emoji: Crying face> im so sad i need a depression nap now,1,oh god youre rightemoji cry face im sad need depression nap
@Mary_R_Roberts I LOOK forward to seeing and sharing ,0,look forward seeing sharing
"@linnetwoods For those watching, In English, The devil knows more because he's old than because he's the devil ",0,watching english devil know old devil
I liked a @YouTube video  http://youtu.be/TpfY8kh5lUw?aÂ  Stories from the Great Depression,1,liked video story great depression
"@eskimowoman no not at all. found it eloquent and entertaining. hence, my recommendation ",0,not all eloquent entertaining hence recommendation
is about to go out and relax in the sun ,0,relax sun
@jaymoskovitz Thanks! I will!  hopefully we'll get a chance to bring then down soon.,0,thanks will hopefully chance bring soon
eekk finally going to bedd! ,0,eekk finally going bedd
Good Morning peeps! ,0,good morning peep
"@Alibaba_OTU LOLOLOL your mom has good theories XDDD. I hope you can manage/overcome your depression! We don't have much privilege to let depression consumes us, but work it slowly at your own pace :D",1,lololol mom good theory xdd hope manageovercome depression not privilege let depression consumes u work slowly pace
"Obese children are more prone to depression, low self-esteem, and negative body image -- but #health and #nutrition programs (@LAsBEST ) can help!  #LAsBESTGAMES donate to my team! https://www.crowdrise.com/o/en/campaign/team-45/monasobhaniÂ â¦",1,obese child prone depression low selfesteem negative body image health nutrition program help lasbestgames donate team
Really important piece from @lisabowhorse about the link between acne and depression  http://metro.co.uk/2018/04/25/acne-causing-depression-7434740/Â â¦,1,really important piece link acne depression
@fawfulfan @AEC_PA @AdreanaInLB @MairinMurphy And what about the suffering of other AA/POC people who arent all set up for the depression and pain Trump is landing on us? Only care abt blk ppl fine..how abt voting in THEIR best interests?,1,suffering aapoc people arent set depression pain trump landing u care abt blk ppl finehow abt voting best interest
@JIDF either im not on the right site or that person is loco ,0,im not right site person loco
@sidpiraya wheres the fun in that? ,0,wheres fun that
"@sarahrosex3 hey love, hope you're doing okay. I'm about to sign onto AIM.  miss you much.",0,hey love hope doing okay sign aim miss much
@nypost @Nilkski_ Next they're gonna say porn cures depression lmao,1,gonna say porn cure depression lmao
"I've been a victim of sexual assaultI've almost witnessed my parents murderI can't go to bed without my medication (sleeping pills and depression pills)I can't stay in a room alone even in daylight... My point is, I manage to be this happy because I pray about everything<Emoji: Tired face><Emoji: Person with folded hands>  pic.twitter.com/wsKSNw0Gho",1,victim sexual assaulti witnessed parent murderi bed medication sleeping pill depression pillsi stay room daylight point is manage happy pray everythingemoji tired faceemoji person folded hand
@fazlynn err thanks? Haha @moonstarlady is jealous alright ,0,err thanks haha jealous alright
depression is slowly crippling me seems only days I leave the house is when I work otherwise im in bed,1,depression slowly crippling day leave house work im bed
@meg_mcbride I've had depression for over twenty years. I love hearing about people who've recovered.,1,depression year love hearing people recovered
Well I watched the episode so I'm gonna go now and go deeper into my depression,1,watched episode gonna deeper depression
"@AffirmationSpot in other words, I may just want one for myself when u finish them ",0,word just want u finish
Reposting @mshapshaycomicbaker: - via @Crowdfire I am because you were. #carriefisher #princessleia #princessleiaforever #starwars #mentalhealth #mentalhealthmatters #sober #sobriety #rehab #recovery #anxiety #depression #bipolar Doing my best to keep your legacy of mental pic.twitter.com/rkpTSwmL62,1,reposting were carriefisher princessleia princessleiaforever starwars mentalhealth mentalhealthmatters sober sobriety rehab recovery anxiety depression bipolar doing best legacy mental
One of my mini poems. #helenswriting#mentalhealth#depression#poetry#Friendship#friends#anxiety#livingwithdepression pic.twitter.com/IT8ZJ8uIo4,1,mini poem helenswriting mentalhealth depression poetry friendship friend anxiety livingwithdepression
YOU GUYS! You can listen to/download my original soundtrack album for THE BATEMAN LECTURES ON DEPRESSION right now on Bandcamp. It's not even a little depressing! #indiefilm #indiefilmmaker https://scottbateman.bandcamp.com/album/the-bateman-lectures-on-depression-original-soundtrackÂ â¦ pic.twitter.com/q3eNmbbqpa,1,guy listen todownload original soundtrack album bateman lecture depression right bandcamp not little depressing indiefilm indiefilmmaker
Check out a fun #history podcast! Because there's nothing sexier than the Great Depression.  https://twitter.com/HistoryInHinds1/status/988941397301571584Â â¦,1,check fun history podcast sexier great depression
"@sarazarr GREAT! I didn't make out with you, but we did snuggle at Geek party! ",0,great did not make you did snuggle geek party
Good Morning @weluvsoccer ,0,good morning
"Despite my random lack of energy, I am *really* happy right now ",0,despite random lack energy really happy right
@mizfox7 just like that  u did it!,0,just like u did it
Um bitch...depression hit me like a truck today,1,um bitchdepression hit like truck today
It's a new day. Time to sit and do nothing for 15 hours. I'm gonna be at home all day. Call me if you wanna talk. ,0,new day time sit hour gonna home day wanna talk
GoodMorning. Skiping the 1st 4 periods and still in the bed. Only goin to 1 class today. ,0,goodmorning skiping st period bed goin class today
I hate sleeping in. Thank god we're leaving soon. Seattle here we come ,0,hate sleeping in thank god leaving soon seattle come
suffering from chronic depression https://vine.co/v/iu3l2lPBhiKÂ ,1,suffering chronic depression
"@rachmurrayX lolz ;) i need to get money, have none atm. if i can get some we should go on monday ",0,lolz need money atm monday
"@Leafybear lol Working for Born Free  we offer animal adoptions, membership etc and need to expand  our operation lol ",0,lol working born free offer animal adoption membership need expand operation lol
Painted my nails pink  Onto hair next! What a productive day! ,0,painted nail pink hair next productive day
"@booshtukka I'll look tonight. Don't bring the laptop to work, given that I have my PC laptop, and iMac desktop here ",0,look tonight not bring laptop work given pc laptop imac desktop
@theshenners I accidentally made my MC depressed because she thought and behaved in the only way I could imagine based on her situation. I decided to run with it because it's rare to see SFF protagonists with chronic depression.,1,accidentally mc depressed thought behaved way imagine based situation decided run rare sff protagonist chronic depression
hmmmm..What are you doing?...im singing a very awesome song  and ima go see a movie called...TERMINATOR SALVATION!!!!!!! OH YEA! BITCH! xD,0,hmmwhat doingim singing awesome song ima movie calledterminator salvation oh yea bitch xd
talking to my mommy then going to bed ,0,talking mommy going bed
"I wish things didn't bother me so much, the smallest thing & I feel my world come crashing down. Why is depression/anxiety so cruel?",1,wish thing did not bother much smallest thing feel world come crashing down depressionanxiety cruel
"I broke my back carrying the burden of this dunya.Love broke me, hate shattered me, depression numbed me, and anxiety ignited my end. How naive of my soul, to burden it so heavily?Ya Rab, when I turned to You, all my worries were but a feather.  pic.twitter.com/YiyGUBqAsa",1,broke carrying burden dunyalove broke me hate shattered me depression numbed me anxiety ignited end naive soul burden heavilyya rab turned you worry feather
"its amazing how depression can take any rare fleeting positive moment and make it feel fraudulent. you are not a fraud, your depression is not fake, if you come across happiness once in a while. you are allowed to feel happiness. you can let yourself feel jik",1,amazing depression rare fleeting positive moment make feel fraudulent not fraud depression not fake come happiness while allowed feel happiness let feel jik
Did you know that 4-10% of people in England will experience depression in their lifetime? #Talkfest #ItsOkToTalk #ThursdayThoughts  http://socsi.in/32qe1Â  http://socsi.in/32qe1Â ,1,did know people england experience depression lifetime talkfest itsoktotalk thursdaythoughts
Why does depression like. Exist,1,doe depression like exist
@ctbosher thats fab you can email me now ,0,thats fab email
"@18percentgrey Um, you're nice!! hahah!! xoxo Lori ",0,um nice hahah xoxo lori
"Spreading awareness about depression and sharing her own struggle with it is one of the reasons why she was included on the list, obviously she's going to continue talking about so ignorant people like you stop seeing it as a joke!",1,spreading awareness depression sharing struggle reason included list obviously going continue talking ignorant people like stop seeing joke
LAKERS WON!!! OT went exactly how it should have ,0,lakers won ot went exactly
@itsneylaafaez hahahaha. i love youu too! ,0,hahahaha love youu too
@Applecored email being checked ,0,email checked
Post-show depression for The Addams Family has been weird and sporadic and my weak heart can't take it so here's some pictures from the show again  pic.twitter.com/SXdIoWjzUP,1,postshow depression addams family weird sporadic weak heart picture
