Text,Label,Score,text_cleaned
FYI y'all can't mourn or celebrate shawty lo cause y'all ain't played his music since 08',sadness,0.5,fyi yall mourn celebrate shawty lo cause yall ai not played music
"@MHChat if we don't understand how to express our emotions to others, may lead to sadness / loneliness &amp; neg impact on long term mh #MHChat",sadness,0.562,not understand express emotion others lead sadness loneliness amp neg impact long term mh mhchat
"@devrajasmine If you change the dark images both look different, but both look like they are in a forest.",sadness,0.438,change dark image look different look like forest
@bldmovs sadly beautiful photo.,sadness,0.375,sadly beautiful photo
ima kitchen sink,sadness,0.333,ima kitchen sink
I should have stayed at home.,sadness,0.458,stayed home
Henderson showing that when times are hard he leaves or goes missing #AFLCatsSwans #seenitbefore #lions #blues,sadness,0.396,henderson showing time hard leaf go missing aflcatsswans seenitbefore lion blue
My son 11 has 128 friends on Facebook and yet is moping around the house complaining he has no one to talk to. I'm right here son,sadness,0.479,son friend facebook moping house complaining talk to right son
Don't get #weary in well doing.\n#Faith #God #prayer,sadness,0.208,not weary doingn faith god prayer
"We fear not the truth, even if it be gloomy, but its counterfeit.- Berl Katznelson",sadness,0.5,fear not truth gloomy counterfeitberl katznelson
God I give you all my pain mess and stress. Take my heavy load. #amen #stress #mess #pain #depression #sadness,sadness,0.8540000000000001,god pain mess stress heavy load amen stress mess pain depression sadness
"All I'm learning about at college atm is Sylvia Plath, Stalin's purges and natural disasters, gloomy af",sadness,0.792,learning college atm sylvia plath stalin purge natural disaster gloomy af
Did you know apples turn brown when a enzyme called polyphenol oxidase reacts with oxygen! Well I do #dull #applefacts 🤓🍏,sadness,0.16699999999999998,did know apple turn brown enzyme called polyphenol oxidase reacts oxygen dull applefacts
@wiIdfuI we have the same age and you're 1000 times more beautiful than me! #sad 😂,sadness,0.521,age time beautiful me sad
"hmm somehow twitter feels really depressing, more like negative today...I think I missed something 😕",sadness,0.75,hmm twitter feel really depressing like negative todayi think missed
@Cassena13 I know if I wasn't an optimist I would despair.,sadness,0.53,know not optimist despair
I came to work for no reason 😩🔫\nI could've stayed in bed,sadness,0.833,came work reason ni stayed bed
"Not written for African-American\n\nNo refuge could save the hireling and slave\nFrom the terror of flight or the gloom of the grave,",sadness,0.583,not written africanamericanno refuge save hireling slavenfrom terror flight gloom grave
"@damiandmusic hubby Noah shares this somber thoughtful photo of his one and only Dami. Ponytail, standout highlights beautiful picture, nice",sadness,0.312,hubby noah share somber thoughtful photo dami ponytail standout highlight beautiful picture nice
or when someone tells me I needa smile like excuse me ??? now I'm just frowning even harder are you happy,sadness,0.5,tell needa smile like excuse just frowning harder happy
I want to pour all my tears on someone right now. So tired of this #upset #sad,sadness,0.958,want pour tear right now tired upset sad
I want to pour all my tears on someone right now. So tired of this #upset ,sadness,0.938,want pour tear right now tired upset
@OniLink86 @DarekMeridian lmao awe...  #sad,sadness,0.521,lmao awe sad
@OniLink86 @DarekMeridian lmao awe... ,sadness,0.292,lmao awe
@reillygolfpro @RealKidPoker @StacyAcey @WSOPTD no he didn't! They are obviously friends and that clouded his judgement,sadness,0.5,did not obviously friend clouded judgement
Where are some great places to listen to blues? #nightlife #NightLifeENT #blues #jazz #gatewayarch #stlouis #washingtonave,sadness,0.229,great place listen blue nightlife nightlifeent blue jazz gatewayarch stlouis washingtonave
@dlrwills turn that frown upside down buddy 🙃.,sadness,0.292,turn frown upside buddy
@patienceinbee @camposanto But I decided to be a bit lackadaisical about getting dressed to get groceries.,sadness,0.417,decided bit lackadaisical getting dressed grocery
"@pikapies I have many happy memories of the Isle Of Wight.\n...\nBut yeah, sink that shit.",sadness,0.479,happy memory isle wightnnbut yeah sink shit
@glenberube @DonnaGrantis @idanielsenbass @HannahJWelton watching this again makes me weep tears of joy and tears of sadness that he's gone,sadness,0.6459999999999999,watching make weep tear joy tear sadness gone
carry on my wayward son there'll be peace when you are done lay your weary head to rest don't you cry no more,sadness,0.5,carry wayward son peace lay weary head rest not
@yourKarma Reaching out AGAIN in hope to contact over the technical issues I am having. Your CS is severely lacking. #badkarma #unhappy,sadness,0.5429999999999999,reaching hope contact technical issue having c severely lacking badkarma unhappy
"I love when #girls are busy in teaching how to #pout while taking #selfie in a mall , their desication is immense #women love #perfection",sadness,0.125,love girl busy teaching pout taking selfie mall desication immense woman love perfection
@PatBlanchfield so you mean “like Uber but for despair for someone other than the driver',sadness,0.479,mean like uber despair driver
@tysonwaters and @WatersWife 'Being over it.' Why USA has #panicattacks #anxiety #depression and so much medication!,sadness,0.708,being it usa panicattacks anxiety depression medication
@typicalmoony Yes Lia!! Join the dark side!!,sadness,0.25,yes lia join dark side
@phil500 \nSo sadden \nSpunky a beautiful dog\nA sad story a lovely happy\nAn loved dog \nPlay little one have fun you\nare so loved,sadness,0.452,nso sadden nspunky beautiful dogna sad story lovely happynan loved dog nplay little fun younare loved
(whisper) I cannot frown.,sadness,0.271,whisper frown
@ananavarro @tcarrels most of Trump supporters have not clue about the meaning of the words they used just like him #sad #nevertrump,sadness,0.6459999999999999,trump supporter not clue meaning word used just like sad nevertrump
@ananavarro @tcarrels most of Trump supporters have not clue about the meaning of the words they used just like him  #nevertrump,sadness,0.542,trump supporter not clue meaning word used just like nevertrump
@RobertWesley3 I'm #mad that my brother is #sad ! Feel better bub!,sadness,0.583,mad brother sad feel better bub
Dentist just said to me' I'm going to numb your front lip up so it'll feel as if you've got lips like Pete Burns!...... She was right #pout,sadness,0.417,dentist just said me going numb lip feel got lip like pete burn right pout
@haileywiggins_ @flenner_alisha good. Takes more muscles to frown than smile,sadness,0.375,good take muscle frown smile
"A pessimist sees the difficulty in every opportunity, an optimist sees the opportunity in every difficulty' -Sir Winston Churchill-",sadness,0.396,pessimist see difficulty opportunity optimist see opportunity difficulty sir winston churchill
The most depressing part of being ill is that your taste goes 😫,sadness,0.8540000000000001,depressing ill taste go
Penny dreadful 3 temporada,sadness,0.438,penny dreadful temporada
"@ProSyndicate thanks for replying, I'm ironing my shirt😂 I'd love to meet you and get an autograph but sadly I'm too young to travel.",sadness,0.417,thanks replying ironing shirt love meet autograph sadly young travel
Shantosh: How crazy would it be to walk past and talk to a person everyday never realizing he is suffering from depression or such? …,sadness,0.688,shantosh crazy walk past talk person everyday realizing suffering depression such
Is it just me or is this a very weird time for the world? #change #enlightenment #gloomy #weird #sigh #imaginepeace #imaginelove #unite,sadness,0.758,just weird time world change enlightenment gloomy weird sigh imaginepeace imaginelove unite
@jamiesmart Huh! It's always my fault isn't it &gt;:( #huff #sulk,sadness,0.7709999999999999,huh fault not gt huff sulk
"Pussies - In the dark, they're all the same",sadness,0.417,pussy dark
For once I gatherp th strength to not try and drink my pain away. #sober #Fighter #strong #lovely #dreamer,sadness,0.479,gatherp th strength not try drink pain away sober fighter strong lovely dreamer
@dublinwaltz bts' 화양연화 trilogy MV is my all time fav🙌 quite gloomy but beautiful as well✨,sadness,0.333,bts trilogy mv time fav quite gloomy beautiful
The ghost of Stefano reflects on the grim indignity of being murdered by corrupt cops in faux love. #days,sadness,0.562,ghost stefano reflects grim indignity murdered corrupt cop faux love day
@againstallaudss @groovydadad @Thelostchild5 @MHChat indeed &amp; is sadness unavoidable? #MHChat,sadness,0.688,amp sadness unavoidable mhchat
Bojack Horseman: the saddest show ever written?? #depression #season1,sadness,0.7290000000000001,bojack horseman saddest written depression season
Incredibly shocked and disappointed with @united customer service. Really making me rethink flying with them in the future. #unhappy,sadness,0.831,incredibly shocked disappointed customer service really making rethink flying future unhappy
"Too many are on their 'yeah, the thing going on with cops shooting innocent people is sad - but just not in my backyard, so..' #sad #blm",sadness,0.7240000000000001,yeah thing going cop shooting innocent people sad just not backyard so sad blm
"Too many are on their 'yeah, the thing going on with cops shooting innocent people is sad - but just not in my backyard, so..'  #blm",sadness,0.708,yeah thing going cop shooting innocent people sad just not backyard so blm
My encouragement today is my dog while my head is in a fog. #epicfail #depression #feelingfedup #tired #ihaveheardeverything #wondering,sadness,0.8540000000000001,encouragement today dog head fog epicfail depression feelingfedup tired ihaveheardeverything wondering
My encouragement today is my dog while my head is in a fog. #epicfail  #feelingfedup #tired #ihaveheardeverything #wondering,sadness,0.6459999999999999,encouragement today dog head fog epicfail feelingfedup tired ihaveheardeverything wondering
Drinkin me some red wine &amp; listening to some fred mcdowell playing the #blues . He did not play no #rocknroll. Fantastic noise  #justsaying,sadness,0.292,drinkin red wine amp listening fred mcdowell playing blue did not play rocknroll fantastic noise justsaying
Love being made to feel bad about being scared of the dark,sadness,0.604,love feel bad scared dark
Is this the Krusty Krab?\n\nNo this is crippling depression,sadness,0.688,krusty krabnno crippling depression
"Has September been dull? Get #SuperSeptember from Jumia Food as a new user. Order from The Place, Barcelos or Shawarma &amp; Co for 30% off",sadness,0.292,september dull superseptember jumia food new user order place barcelos shawarma amp
@POCX100 Please don't sulk over your defeat. Come on. Head up!,sadness,0.25,not sulk defeat come on head up
me: i've actually been doing pretty well! i'm learning to manage my depression and-\nlife: yeah that's over. that's cancelled.,sadness,0.604,me actually doing pretty well learning manage depression andnlife yeah over cancelled
@MariamVeiszadeh #depressing it's so freaking close !,sadness,0.679,depressing freaking close
Trial result #sadness,sadness,0.7290000000000001,trial result sadness
I am more comfortable here at the Dove House than I was in my own home for 24 years. This is HOME &amp; I am very grateful. #dove #indy #sober,sadness,0.239,comfortable dove house home year home amp grateful dove indy sober
"Only God knows why things happen, sometimes it's just hard to understand. #sad #prayingforyou",sadness,0.875,god know thing happen just hard understand sad prayingforyou
"Only God knows why things happen, sometimes it's just hard to understand.  #prayingforyou",sadness,0.529,god know thing happen just hard understand prayingforyou
Just because I'm hurting \nDoesn't mean I'm hurt \nDoesn't mean I didn't get \nWhat I deserved \nNo better and no worse #lost  @coldplay,sadness,0.583,just hurting ndoes not mean hurt ndoes not mean did not nwhat deserved nno better worse lost
Fashion week this year is dull AF! Someone inspire me!!!!!! 😩,sadness,0.438,fashion week year dull af inspire me
"Take heart amid the deepening gloom that your dog is finally getting enough cheese. ― National Lampoon, 'Deteriorada'",sadness,0.521,heart amid deepening gloom dog finally getting cheese national lampoon deteriorada
It's always over.. until I'm no longer sober... then it feels like I wana start over #UL,sadness,0.625,over longer sober feel like wana start ul
its so unfortunate that after all these years im still struggling with depression smh,sadness,0.833,unfortunate year im struggling depression smh
Ghanaians don't need to wear black to mourn tho... They can just walk naked *dodges stones* Na joke na☹',sadness,0.375,ghanaians not need wear black mourn tho just walk naked dodge stone na joke na
@RonBaker6694 I got a super speeder and lost my license for 6 months! 😩🔫,sadness,0.583,got super speeder lost license month
@ScottCarmichae1 @Murican_Stuff don't fret -- this guy is mad because when @realDonaldTrump  is elected he might have to get a real job,sadness,0.312,not fret guy mad elected real job
"@KhaleesiofFood @BB_Updates she has stayed off the block almost all season, got out people that were good for her game, but no one seemed",sadness,0.333,stayed block season got people good game
@gurrie_j thanks for making me super sad about Pizza.  #freepizza,sadness,0.521,thanks making super sad pizza freepizza
@gurrie_j thanks for making me super sad about Pizza. #sad #freepizza,sadness,0.5,thanks making super sad pizza sad freepizza
Inadequacy slithers from her ears and wraps itself around her neck like the boys she wants to love her. #mpy #vss #quote #depression #poetry,sadness,0.562,inadequacy slithers ear wrap neck like boy want love her mpy v quote depression poetry
&amp; like if your unhappy just leave. don't cheat on someone &amp; than up their view on love &amp; shit 💯..,sadness,0.5,amp like unhappy just leave not cheat amp view love amp shit
@teenageic0n_ you'll be pleased to know my family are blues,sadness,0.333,pleased know family blue
"@Meruna_  as a musician, I can tell you that more people get discouraged when learning because of shitty instruments than anything else.",sadness,0.675,musician tell people discouraged learning shitty instrument else
Hi guys! I now do lessons via Skype! Contact me for more info. #skype #lesson #basslessons #teacher #free lesson #music #groove #rock #blues,sadness,0.16699999999999998,hi guy lesson skype contact info skype lesson basslessons teacher free lesson music groove rock blue
Rockin to  Bob Dylan singin'  Bob Dylan's 115th Dream on LPCO Klassic Rock #classicrock #klassicrock #rocknroll #blues #onlineradio,sadness,0.188,rockin bob dylan singin bob dylan th dream lpco klassic rock classicrock klassicrock rocknroll blue onlineradio
feel really sad and down today😒,sadness,0.833,feel really sad today
But right now I'm feeling pretty desolate.,sadness,0.833,right feeling pretty desolate
#Drunk people annoy me when I'm #sober lol. | #fact #TeamFollowBack #RockTheReTweet,sadness,0.375,drunk people annoy sober lol fact teamfollowback rocktheretweet
@_JESSICAVIDAL_ Just pour it down the sink and let him drink you.,sadness,0.354,just pour sink let drink you
@Dark_Intell Darius' article was what convinced me that the time and money I had sunk into the IGDA in past years was wasted. Good re-read.,sadness,0.438,darius article convinced time money sunk igda past year wasted good reread
i really want to read this fic i found but it's #serious and this room is full of #memes,sadness,0.292,really want read fic room meme
UPLIFT: If you're still discouraged it means you're listening to the wrong voices &amp; looking to the wrong source. Look to the LORD!,sadness,0.333,uplift discouraged mean listening wrong voice amp looking wrong source look lord
I'm strong 'cause I'm weak\nI'm beautiful 'cause I know my flaws\nI'm fearless 'cause I've been afraid\nI can laugh 'cause I've known sadness..,sadness,0.5,strong cause weakni beautiful cause know flawsni fearless cause afraidni laugh cause known sadness
This is the @Fender #blues #junior. I'm looking forward to play on it as soon as possible. #guitar #guitarrist #music,sadness,0.16699999999999998,blue junior looking forward play soon possible guitar guitarrist music
Dreams dashed and divided like million stars in the night sky.,sadness,0.688,dream dashed divided like million star night sky
You are NOT your struggle or You are NOT your affliction! #YouAreStrong &amp; #YouAreArising above it all!,sadness,0.271,not struggle not affliction youarestrong amp youarearising all
Fun tidbit: You can fall asleep on someone while dancing. #blues #latenight,sadness,0.083,fun tidbit fall asleep dancing blue latenight
The #sober equivalent of being in a #bar women's restroom is the #salon. Everyone compliments each other &amp; become friends. I love it,sadness,0.271,sober equivalent bar woman restroom salon compliment amp friend love
"I lost my wallet, then found it, then lost it again AND THEN FOUND IT!!!!! \nCollege is brazy",sadness,0.125,lost wallet it lost it ncollege brazy
@hedgegirl I was only joking. I don't have any parents. 😈 #dark,sadness,0.375,joking not parent dark
"oh, btw - after a 6 month depression-free time I got a relapse now... superb #depression",sadness,0.917,oh btw month depressionfree time got relapse now superb depression
"oh, btw - after a 6 month depression-free time I got a relapse now... superb ",sadness,0.75,oh btw month depressionfree time got relapse now superb
"Absolutely hate the Apple Watch iOS 10 update. Completely buggered some of my apps, including Spark. Awful interface, too. #grim",sadness,0.562,absolutely hate apple watch io update completely buggered apps including spark awful interface too grim
"The animals, the animals\nTrap trap trap till the cage is full\nThe cage is full, stay awake\nIn the dark, count mistakes",sadness,0.417,animal animalsntrap trap trap till cage fullnthe cage full stay awakenin dark count mistake
Love is when all your happiness and all your sadness and all your feelings are dependent on another person.,sadness,0.333,love happiness sadness feeling dependent person
"@antoboyle I so wish you could someday come to Spain with the play, I can't believe I'm not going to see it #sad",sadness,0.708,wish someday come spain play believe not going sad
"@antoboyle I so wish you could someday come to Spain with the play, I can't believe I'm not going to see it ",sadness,0.354,wish someday come spain play believe not going
Always borrow money from a pessimist; he doesn't expect to be paid back.,sadness,0.4,borrow money pessimist doe not expect paid back
But guess what ? I'm sober,sadness,0.188,guess sober
@MissFushiGaming I hashtag things and the kids always tell me to stop 😭😭😭😭😭 #sadness,sadness,0.625,hashtag thing kid tell stop sadness
"@WalshFreedom sadly, that idiot completely overlooks the facts . He had a gun pointed at police. Are they that stupid?That should be ignored",sadness,0.542,sadly idiot completely overlook fact gun pointed police stupidthat ignored
"@localblactivist I'm always a little bit weary of speaking up because 1. I don't want to hijack the convo - as an LGBT person, I've seen",sadness,0.438,little bit weary speaking not want hijack convo lgbt person seen
Go away please ... I'm begging »»» #depression #anxiety #worry #fear #sadness \nDreams of joy and my baby to be found...Sits on #AndisBench,sadness,0.8959999999999999,away begging depression anxiety worry fear sadness ndreams joy baby foundsits andisbench
This nigga doesn't even look for his real family 🙄😂 #sad,sadness,0.7290000000000001,nigga doe not look real family sad
This nigga doesn't even look for his real family 🙄😂 ,sadness,0.25,nigga doe not look real family
So blend the waters lie\nThere shrines and free-  The melancholy waters lie\nNo rays from out the dull tide-  As if the vine,sadness,0.438,blend water lienthere shrine free melancholy water lienno ray dull tide vine
God knows why you'd wanna go with a girl who's slept with half ya mates #grim,sadness,0.479,god know wanna girl slept half ya mate grim
People are trying too hard to hate on Cam Newton without understanding his position #sad,sadness,0.604,people trying hard hate cam newton understanding position sad
People are trying too hard to hate on Cam Newton without understanding his position ,sadness,0.354,people trying hard hate cam newton understanding position
@cristinalaila1 just when I thought this disgusting man couldn't sink any lower-like Hillary he his depravity of character has no bottom,sadness,0.667,just thought disgusting man not sink lowerlike hillary depravity character
@SizweM01 and it's kinda depressing hey!!! 😑,sadness,0.667,kinda depressing hey
@KseniaSolo hi little late to lost girl but think you awesome from South Afrikaans:-),sadness,0.229,hi little late lost girl think awesome south afrikaans
@MiSSLiNDZO no. 😭 the last two we were out-bidded. So we got kinda discouraged so now we are taking our sweet time. The market is stupid tho,sadness,0.583,no outbidded got kinda discouraged taking sweet time market stupid tho
Way to get a hold of her 😊 #depressing,sadness,0.54,way hold depressing
TVGirl is like I'm really pretty and melancholic about life and this is why I hate myself,sadness,0.7290000000000001,tvgirl like really pretty melancholic life hate
Actually I always idealize the end of my relationships .. Such a pessimist,sadness,0.6459999999999999,actually idealize end relationship pessimist
After she threw me out I had to sedate her. With a damn horse tranquilizer.',sadness,0.354,threw sedate her damn horse tranquilizer
Man city's kit is dreadful!,sadness,0.522,man city kit dreadful
"There will be no #gaming video today. An old friend of mine passed last night, so I'm taking some time to grieve. Thank you #StandUpToCancer",sadness,0.792,gaming video today old friend passed night taking time grieve thank standuptocancer
"I did the dishes yesterday, fell asleep, woke up to the sink full and I didn't even eat dinner but I have to do the dishes.",sadness,0.625,did dish yesterday fell asleep woke sink did not eat dinner dish
"even if it looks like we are okay,  the reality of that is were actually very worn out and forlorn",sadness,0.667,look like okay reality actually worn forlorn
Interesting topic this evening...  sadness &amp; low mood. #MHChat,sadness,0.708,interesting topic evening sadness amp low mood mhchat
"someone explain female human beings to me, they're depressing me ._.",sadness,0.812,explain female human being me depressing
Dont dull #Dutty_Wednesday,sadness,0.298,dont dull duttywednesday
@brawl2099 See your primary care doctor. They can prescribe meds and refer you to a psychiatrist for eval. Don't mess with depression.,sadness,0.521,primary care doctor prescribe med refer psychiatrist eval not mess depression
@kagehime3 I'm so starved for content I'd take it but I'd def pout about it (՟ິͫઘ ՟ິͫ),sadness,0.5,starved content def pout
"@ChrisWarcraft species cf. Don Jr. refugees/Skittles.know he likes his snacks,but even @gop frown on talking about eating humans #lizardscum",sadness,0.46,specie cf don jr refugeesskittlesknow like snacksbut frown talking eating human lizardscum
Trying to make a #better_world is #depressing when it's a #failure -__-,sadness,0.812,trying make betterworld depressing failure
Lines from Don't Quit take me to a place of ultimate strength when I start to feel weary. 💪🏾,sadness,0.479,line not quit place ultimate strength start feel weary
That's the old me though #imachildofgod #whatistwerking #sober #married #bye,sadness,0.458,old imachildofgod whatistwerking sober married bye
@mcjamie sadly. It's just.. Did the dude have to yell out the frogs name at the Clinton rally that one day. It changed everything,sadness,0.377,sadly just did dude yell frog clinton rally day changed
Is that hurting..? [Features get a tad somber while attempting to sense @MischievousTyke's temperature],sadness,0.375,hurting feature tad somber attempting sense temperature
doese reading help depression or is it another form of escapism,sadness,0.667,doese reading help depression form escapism
#Gratitude - recovery health love God conscious drive hope perseverance wealthy home kids SoCal #recoveryfit youthful #sober,sadness,0.292,gratitude recovery health love god conscious drive hope perseverance wealthy home kid socal recoveryfit youthful sober
Idk why people be glorifying depression. I wouldn't wish real depression upon my worst enemy. Shits the worst stop acting like it's cool,sadness,0.828,idk people glorifying depression not wish real depression worst enemy shit worst stop acting like cool
Maybe I can sleep with my chem book on my head and it will all sink in my brain,sadness,0.438,maybe sleep chem book head sink brain
i cant live anymore my roblox got termianted :(((((((((((((((((((((((( #sad #killme #lol #robloxgamer,sadness,0.792,live anymore roblox got termianted sad killme lol robloxgamer
i cant live anymore my roblox got termianted :((((((((((((((((((((((((  #killme #lol #robloxgamer,sadness,0.625,live anymore roblox got termianted killme lol robloxgamer
"Come here, let me do whatever I do with it. #dismal",sadness,0.583,come here let it dismal
"When it comes to Syria, I get very fucking annoyed at pessimism, like I get full on triggered. Optimism or gtfo.",sadness,0.583,come syria fucking annoyed pessimism like triggered optimism gtfo
