Text,Label,Score,text_cleaned
It's become a verb. 'I'm gonna Villaseñor all those old contacts I don't need anymore.' #sadness @melissavcomedy #waitingforexplanation,sadness,0.542,verb i gonna villaseor old contact not need anymore sadness waitingforexplanation
@HillaryClinton @TheDemocrats It's ok 2 be disgusted or dishearten with presidential race but don't let that stop u from voting IT MATTERS,sadness,0.542,ok disgusted dishearten presidential race not let stop u voting matter
5am blues while riding a cab home:\n- my belly is much bigger than the rest of my body\n- but i couldnt be preggy\n- how to lose it in a day,sadness,0.542,am blue riding cab homen belly bigger rest bodyn preggyn lose day
Ill say it again. If I was a Black man Id be afraid to leave my house or have a moving violation.\n\n #TerranceCrutcher #truth ,sadness,0.542,ill say again black man id afraid leave house moving violationn terrancecrutcher truth
"@narcissusheiyan  maybe it'd have been different if I stayed for sixth form? But still, the oppressive architecture, uninteresting people",sadness,0.542,maybe different stayed sixth form still oppressive architecture uninteresting people
@WYSdaily I'm confident they will NEVER experience our successes of last 50yrs. Best they can hope for is to be another Bournemouth #sad,sadness,0.542,confident experience success yr best hope bournemouth sad
"What's good is that we already hit rock bottom, even though I'm about two more seasons away from new depths of despair. #playoffs? #NJDevils",sadness,0.542,good hit rock bottom season away new depth despair playoff njdevils
"Absolutely can not believe the generosity pouring out for us, but Id give everything I have for Nick to be healthy and happy. #lost",sadness,0.542,absolutely not believe generosity pouring u id nick healthy happy lost
i got his bitch depress,sadness,0.542,got bitch depress
@Groupon_UK who do I contact about a shocking experience with Clear Sky Holidays booked through you guys?? #customerservicefail #dreadful,sadness,0.542,contact shocking experience clear sky holiday booked guy customerservicefail dreadful
"@cotsonika @NHL well, they should all be unhappy for the way they played.  Right @fmjacob ??",sadness,0.542,well unhappy way played right
"@simslover163 I guess it must be really expensive... For me it's that the whole family stayed in Poland, so I really miss them...",sadness,0.542,guess really expensive family stayed poland really miss them
Regret for the things we did can be tempered by time; it is regret for the things we did not do that is inconsolable.  Sydney J. Harris,sadness,0.542,regret thing did tempered time regret thing did not inconsolable sydney j harris
untypical kinda Friday #dull,sadness,0.542,untypical kinda friday dull
"My oldest cat pisses me off. She's always been weary of Kennen (senile kinda), but recently shes been sweet. Until she attacked and bit him.",sadness,0.542,oldest cat piss off weary kennen senile kinda recently shes sweet attacked bit him
@WestermannNina xDD it's a song that can not be weary (?),sadness,0.542,xdd song not weary
Feels grim not having your nails done,sadness,0.542,feel grim not having nail
"How could such a crooked,stuck up,delusional,dim&amp; #dark hearted dud be surprised losing&amp;prob also ppl won't let their crimes drop! #nwo imo",sadness,0.541,crookedstuck updelusionaldimamp dark hearted dud surprised losingamprob ppl not let crime drop nwo imo
That AK47 leave your spine with a frown,sadness,0.521,ak leave spine frown
a good shorty has so much to offer &amp; it's sad that some of you niggas don't even see it when she right in front of your face and too late,sadness,0.521,good shorty offer amp sad nigga not right face late
@theJeremyVine Noel Edmonds reckons a cat he's talking to is stressed because of the uncertainty over #GBBO future!?!? #plot #lost,sadness,0.521,noel edmonds reckons cat talking stressed uncertainty gbbo future plot lost
One way ticket to the blues.,sadness,0.521,way ticket blue
"@thehill George H. Establishment is unhappy Trump's campaign branded his son low-energy, but he could not have beaten the others either.",sadness,0.521,george h establishment unhappy trump campaign branded son lowenergy not beaten either
Marcus Roho is dreadful,sadness,0.521,marcus roho dreadful
"Im kind of confused.  The one thing i do right now has a great future, but on the other hand so does the new thing .  #needhelp",sadness,0.521,im kind confused thing right great future hand doe new thing needhelp
Finished writing my second book tonight. #somber #sad #youpromised #havemercy #author #writer #needpublisher #beingedited #workingonsidebook,sadness,0.521,finished writing second book tonight somber sad youpromised havemercy author writer needpublisher beingedited workingonsidebook
@ArcadianLuthier -- taking out his feelings on Kei unfairly. His lips form a frown as he tries to walk away.,sadness,0.521,taking feeling kei unfairly lip form frown try walk away
@DeltaAssist Tried 2 get earlier flt 2day  @BWI Turnd away bcuz it was 2 late Then agent let other pas on #silvereliteleftbehind ,sadness,0.521,tried earlier flt day turnd away bcuz late agent let pa silvereliteleftbehind
Thank God she warned me before I walked to that sink cause lord knows I would've been sick to my stomach and would've wanted to sue lbvfs,sadness,0.521,thank god warned walked sink cause lord know sick stomach wanted sue lbvfs
So now... yeah. I'm home again.\nStill feeling mixed up inside &amp; kinda gloomy. But a little more optimistic that I'll figure this out.,sadness,0.521,now yeah home againnstill feeling mixed inside amp kinda gloomy little optimistic figure out
penny dreadful just cleaved off a fraction of my heart,sadness,0.521,penny dreadful just cleaved fraction heart
"@fitzstockcharts Gundlach calling for rounding top, doom and gloom, 15% down move",sadness,0.521,gundlach calling rounding top doom gloom
"Everything is far away because time is short, no rest for the weary.",sadness,0.521,far away time short rest weary
@chelseafc let them know it's the #blues,sadness,0.521,let know blue
We want to help you with your #depression. Give our office a call to learn how #TMS may be the treatment you've been waiting for!,sadness,0.521,want help depression office learn tm treatment waiting for
"@AliceGoodman17 i dunno, I'm getting less of the spacious lovely autumnal melancholy from our present apocalypse",sadness,0.521,dunno getting spacious lovely autumnal melancholy present apocalypse
Got paid to vacuum up rat poop. (-: never a dull day in the biology department ...,sadness,0.521,got paid vacuum rat poop dull day biology department
"#Terencecutcher #Tulsa the man onthe helicopter said he looks like a bad dude, that is the problem, when they see black they see bad, ",sadness,0.521,terencecutcher tulsa man onthe helicopter said look like bad dude problem black bad
@pandaflo22 We are sadden by this because we always strive to bring the best service to our customer. We will always be here for you. CM,sadness,0.521,sadden strive bring best service customer you cm
Someone needs to tell Candice she'll be stuck with that shitty pout if the wind changes. #GBBO,sadness,0.521,need tell candice stuck shitty pout wind change gbbo
When health insurance won't cover TMS but they let me know they cover ECT #mentalhealth #psychology  #TMS #ECT,sadness,0.521,health insurance not cover tm let know cover ect mentalhealth psychology tm ect
@PurpleReplisol meden is frowning at you with her non existent face,sadness,0.521,meden frowning non existent face
@realDonaldTrump negative campaign of doom and gloom don't win elections,sadness,0.521,negative campaign doom gloom not win election
"if you have been on depression too u shouldn't be judging him and exposing him to everyone, but helping him",sadness,0.52,depression u not judging exposing everyone helping
@mattwruff sadly there is constitutional RIGHT to have abortion. Yet there is constitutional RIGHT to life. Safety net protects those rights,sadness,0.514,sadly constitutional right abortion constitutional right life safety net protects right
@HeyCaraJay I am inconsolable at this GIF in context,sadness,0.509,inconsolable gif context
"@StarklyDark 'Come here. Come on. Into my arms. I'm not going anywhere, Tony, I swear.' Steve told him, quiet and solemn.",sadness,0.5,come here come on arm not going anywhere tony swear steve told him quiet solemn
Lisa: Getting what you want all the time will ultimately leave you unfulfilled and joyless.,sadness,0.5,lisa getting want time ultimately leave unfulfilled joyless
@harowe this sad truth!,sadness,0.5,sad truth
@questlove when are people going to realize that these 'riots' are just perpetuating hate. Saying you're going to boycott a city!?! #lost,sadness,0.5,people going realize riot just perpetuating hate saying going boycott city lost
Don't wanna go to work but I want the money ,sadness,0.5,not wanna work want money
@ManUtd Rooney needs to come off! Absolutely dreadful! 🙈🙈🙈 class goal from @carras16 @carras16 showing why he should be in the team!!,sadness,0.5,rooney need come off absolutely dreadful class goal showing team
Y'all tune into Snapchat for Beans funereal,sadness,0.5,yall tune snapchat bean funereal
"At my funeral, when they close the casket, I want them to play, 'Call recording has completed.'' -@GlenEwing #lost #podcasting #talkshoe",sadness,0.5,funeral close casket want play call recording completed lost podcasting talkshoe
@RyhenMessedUp goodbye despair,sadness,0.5,goodbye despair
Ffs dreadful defending,sadness,0.5,ffs dreadful defending
@raylewis name change Uncle Remus Lewis #foh #theydontlikeyoueither #lost #unwoke,sadness,0.5,change uncle remus lewis foh theydontlikeyoueither lost unwoke
"the waitress recognised me from last time i was in there moping, after my interview haha",sadness,0.5,waitress recognised time moping interview haha
What day is it #lost,sadness,0.5,day lost
Has anyone noticed that @npr stories in recent days all paint positive accomplishments for Trump and challenges for Hillary? #surprised #sad,sadness,0.5,noticed story recent day paint positive accomplishment trump challenge hillary surprised sad
"@ChibiReviews Post series depression can be quite bad, but it will get better, I bet someone will pick the novel soon in the west.",sadness,0.5,post series depression quite bad better bet pick novel soon west
@iTriborg — make him feel vigorous. 'Fine. You can kill me now.' Said Hestia with a display of only despair rather than her joyful —,sadness,0.5,make feel vigorous fine kill now said hestia display despair joyful
"236:416 While she was in her dull and sleeping hour,\nA crew of patches, rude mechanicals,\n#AMNDBots",sadness,0.5,dull sleeping hourna crew patch rude mechanicalsn amndbots
"The 2nd step to beating #anxiety or #depression is realising that it's not about waiting for ...., Take action yourself now.",sadness,0.495,nd step beating anxiety depression realising not waiting action now
@SimonSSSJ123 @EllieG10853 @Onision @Eugenia_Cooney he sure as hell helped me with my depression and still does,sadness,0.485,sure hell helped depression doe
@jccrocker #CharlotteProtest do u #wait 4 the facts #video or do u #hate now ask questions later  #protest #PoliceShootings #suggestions,sadness,0.479,charlotteprotest u wait fact video u hate ask question later protest policeshootings suggestion
"@Nataliem55 sadly, war has often been the factor that jump starts US economic growth",sadness,0.479,sadly war factor jump start economic growth
@GrimsToyShow grim what the fuck going on with these dame fucking clowns takeing the gameing channel if I had a way to nj I would delete,sadness,0.479,grim fuck going dame fucking clown takeing gameing channel way nj delete
"Leeds surely to drop the prices for that cup tie, rather than the dismal attendance last night..",sadness,0.479,leeds surely drop price cup tie dismal attendance night
@greencapt there's something to note in the fact that the mask manufacturer produced her smiling and him frowning.,sadness,0.479,note fact mask manufacturer produced smiling frowning
The word happiness would lose its meaning if it were not balanced by sadness.,sadness,0.479,word happiness lose meaning not balanced sadness
@TouchPH  The solution is to punish the criminals. That's the only way to discourage crime. or the circle will continue.,sadness,0.479,solution punish criminal way discourage crime circle continue
@KristenWACamera I really enjoyed both episodes. I had a bit of a gloomy day today but I feel a sense of inspiration from listening.,sadness,0.479,really enjoyed episode bit gloomy day today feel sense inspiration listening
"1Pet 4:7  But the end of all things is at hand: be ye therefore #sober, and #watch unto prayer",sadness,0.479,pet end thing hand ye sober watch unto prayer
"@aidanparr haha!! No, sorry was it too grim even for you?! It disturbed me &amp; im starting to lose all trust in Twitter generally!!",sadness,0.479,haha no sorry grim you disturbed amp im starting lose trust twitter generally
"Literally had a guy (a some-would-say-successful guy) tell me 'this ship will sail' kay guy, first, you're working with a sub, last, it sunk",sadness,0.479,literally guy a somewouldsaysuccessful guy tell nothis ship sail kay guy first working sub last sunk
@RaveenElexiis I fought a racist girl and she stayed in GAVC so if you get kicked out I call BS,sadness,0.479,fought racist girl stayed gavc kicked b
How brave are the young individuals that have opened up to us about their #depression and #anxiety to help raise awareness!! @beyondblue,sadness,0.479,brave young individual opened depression anxiety help raise awareness
Just rough situations all around for Schalke and Werder Bremen to start the campaign. Bremen dashed late with a new manager. Both with 0.,sadness,0.479,just rough situation schalke werder bremen start campaign bremen dashed late new manager
"Don't blame yourself,' he spoke, as if she were in the room, kicking the chair beneath him.\n#amwriting #dark",sadness,0.479,not blame yourself spoke room kicking chair beneath himn amwriting dark
"@ActualFlatticus @veggie64_leslie @mtracey Call me a pessimist, but I don't think therapy can fix whatever is wrong with Anthony Weiner.",sadness,0.479,pessimist not think therapy fix wrong anthony weiner
November #canola lost $5.50 to $464.20 per tonne.,sadness,0.479,november canola lost tonne
"@ticcikasie1 With a frown, she let's out a distraught 'Gardevoir' saying that she wishes she had a trainer",sadness,0.479,frown let distraught gardevoir saying wish trainer
Brad Pitt being investigated for child abuse?! this all just got really #dark,sadness,0.479,brad pitt investigated child abuse just got really dark
Bare videos online but does anyone get rehabilitated? Does anyone actually get help for their affliction? Or do we jut get twitter videos.,sadness,0.479,bare video online doe rehabilitated doe actually help affliction jut twitter video
Always do sober what you said you'd do drunk. That will teach you to keep your mouth shut. \n― Ernest Hemingway #quote,sadness,0.479,sober said drunk teach mouth shut n ernest hemingway quote
"[My teeth were sunk down into the vein of the poor woman who had 'accidentally' had a small problem with her engine, just outside of --",sadness,0.479,my teeth sunk vein poor woman accidentally small problem engine just outside
@lebara - worst possible decision I could have made when arriving in the UK. Shocking service. Poor coverage. ,sadness,0.479,worst possible decision arriving uk shocking service poor coverage
lost my 244 day snapchat streak i'm done,sadness,0.477,lost day snapchat streak
@ReserveHinata tend to them he's going to get infections. \n\nHe's frowning and looking down as he does this. \nIt must hurt damn.],sadness,0.475,tend going infection nnhe frowning looking doe this nit hurt damn
@EmotionalLimine you're sadly mistaken if you think I'd make a tweet for an isolated comment by a random twitter user.,sadness,0.469,sadly mistaken think make tweet isolated comment random twitter user
@ATTCares why do I have 2 wait 48 hours to call YOU back to cancel an order I JUST placed after already spending 2 hours on the phone?! ,sadness,0.464,wait hour cancel order just placed spending hour phone
i stopped watching gotham cause they dropped off tabitha and barb's relationship and made her pine after the main,sadness,0.461,stopped watching gotham cause dropped tabitha barb relationship pine main
"@_JuliaSteiner : I liked that she was not moping around in all of the episode. She had a moment of emotional weakness, felt sorry about -",sadness,0.46,liked not moping episode moment emotional weakness felt sorry
@WYSdaily I'm confident they will NEVER experience our successes of last 50yrs. Best they can hope for is to be another Bournemouth ,sadness,0.458,confident experience success yr best hope bournemouth
Never leave me alone with my credit card. Nope nope mope.,sadness,0.458,leave credit card nope nope mope
@SandraTXAS @6bird4 @CajunKangaroo @justanavywife please. Or you could be clouded by your passion. Emotion leads you from the truth.,sadness,0.458,please clouded passion emotion lead truth
The horrible puns for the day have been made. I shall return to my cage in a dark corner by myself while crying &amp; laughing hysterical now.,sadness,0.458,horrible pun day made shall return cage dark corner cry amp laughing hysterical now
"My house isnt always a mess but when it is, its when i have friends coming #mess #serious #twitter #problem #like #friends #filthy #home",sadness,0.458,house isnt mess is friend coming mess twitter problem like friend filthy home
“We can easily #forgive a #child who is #afraid of the #dark; the real #tragedy of #life is when #men are #afraid of the #light.”–Plato,sadness,0.458,easily forgive child afraid dark real tragedy life men afraid lightplato
"@DxfyingGrxvity - that were rather forlorn, scanning the witches house before resting back on Elphie. 'The Grimmerie is gone.'",sadness,0.458,forlorn scanning witch house resting elphie the grimmerie gone
@FacMagnaAmerica  #CureForInsomnia And the left said WE were all doom &amp; gloom. The Trump Train is so much more fun!,sadness,0.458,cureforinsomnia left said doom amp gloom trump train fun
History repeating itself..GAA is our culture how dare anyone think it's ok to discourage any Irish person from attending any match or final,sadness,0.458,history repeating itselfgaa culture dare think ok discourage irish person attending match final
Mayor visits downtrodden part o town in brave PR stunt. More at eleven.,sadness,0.458,mayor visit downtrodden o town brave pr stunt eleven
went to Pet Supplies Plus tonight but @neitzkeamara was not working I feel #lost and #confused,sadness,0.458,went pet supply plus tonight not working feel lost confused
@mik61scot @longshankseddie @ROSAZAMBONINI @YouTube I thought it was because she once sunk her teeth into something that's meant 2b sooked,sadness,0.458,thought sunk teeth meant b sooked
@VivYau is it all doom and gloom? I only want to hear lovely things about airbnb!,sadness,0.458,doom gloom want hear lovely thing airbnb
"@ynnsanity Maybe that's why, we're asked to study hard and get a job that we like. That way it wouldn't be that dreadful.",sadness,0.458,maybe why asked study hard job like way not dreadful
"@Cpt_SRogers_\n'Well it can go one of two ways. You either get over it and accept it, because it's not going to change, or you mope about --",sadness,0.458,nwell way accept it not going change mope
@CarrieLynne2323 totally get it. When you've said no to donuts 13 times one week and lost 0.3 lbs you get discouraged! But it's not linear 😘,sadness,0.458,totally it said donut time week lost lb discouraged not linear
You don't know how to love me when you're sober #sober #selenagomez #revival,sadness,0.458,not know love sober sober selenagomez revival
@SkyNews err I wasnt gloomy.  17.2 mio people were not gloomy only #remain were #Brexit,sadness,0.458,err wasnt gloomy mio people not gloomy remain brexit
"@coalese 😂😂😂. Sure half these stars get together,break up,have affairs,let porn vids slip out,fight,ect etc all to up there ratings. #sad 😂",sadness,0.458,sure half star togetherbreak uphave affairslet porn vids slip outfightect rating sad
Im so serious about putting words in my mouth bitch don't add ' the ' to my sentence if I didn't say that shit on bloods,sadness,0.458,im putting word mouth bitch not add sentence did not say shit blood
@theflabar It's a #foggy and #dark morning here - so #filter this time.  For #lighting purposes. :),sadness,0.458,foggy dark morning filter time lighting purpose
What do you do?'\n'You are not worthy enough to know.' #what #serious,sadness,0.458,donyou not worthy know
"If a friend lost his/her phone, how long do they have to mourn their lost phones before you ask for their earpiece?",sadness,0.458,friend lost hisher phone long mourn lost phone ask earpiece
"@LucidBurrito Doesnt do it to anyone else, he literally pulled me into the office cause someone complained I spit in the sink yesterday",sadness,0.457,doesnt else literally pulled office cause complained spit sink yesterday
Why doesn't anybody I know watch penny dreadful? ☹️️,sadness,0.455,doe not anybody know watch penny dreadful
Am a very old person I can't handle some stuff....lol I just left her there.... Get back to me when you're sober,sadness,0.455,old person handle stufflol just left there sober
@BTS_twt people have so much negativity filled inside them but im always happy that in such a gloomy world someone like u exists Namjoon,sadness,0.45,people negativity filled inside im happy gloomy world like u exists namjoon
. @UNFCCC @uncclearn The problem is the time it has taken to do this means its going to be out of date already. #sadly,sadness,0.445,problem time taken mean going date already sadly
"Trying to think positive, and not let this situation discourage me ✨✨✨✨✨✨✨✨✨✨✨✨✨✨✨✨✨✨✨✨✨✨✨✨✨✨✨✨✨✨✨✨✨✨✨✨✨✨✨✨✨✨✨✨✨✨✨✨✨✨✨✨✨✨✨✨✨✨✨✨✨✨✨✨✨✨✨✨✨✨✨✨✨",sadness,0.44,trying think positive not let situation discourage
Candice on great british bake off with that pout does my head in 👊🏻🙄,sadness,0.438,candice great british bake pout doe head
@BBCSport too dull for the UK.,sadness,0.438,dull uk
@LazyBoiSam blues... blues? 🤔,sadness,0.438,blue blue
Sometimes I think the British political landscape is desolate and then I look over at the foaming wasteland of the US and think we're OK,sadness,0.438,think british political landscape desolate look foaming wasteland think ok
"@kikibug13 Don't look. You'll only be very, very unhappy. \n\n(NNGH. I got the email notif THANK YOU.)",sadness,0.438,not look very unhappy nngh got email notif thank you
Positive thoughts on these gloom cloudy days,sadness,0.438,positive thought gloom cloudy day
When you're on a train as its pitch black outside and you have no idea where you are... #travel #whereami #lost #adventure,sadness,0.438,train pitch black outside idea are travel whereami lost adventure
"@Ren102e906 Just do what you can, don't get discouraged, maybe some prayers for divine intervention to help you would help :)",sadness,0.438,just can not discouraged maybe prayer divine intervention help help
"@Janet_Reid Wonderful post! Novelists shouldn't be discouraged by rejection, but they usually are because their work is so personal.",sadness,0.438,wonderful post novelist not discouraged rejection usually work personal
Cheap pout my brodcast,sadness,0.438,cheap pout brodcast
"So I tried to give her time to sober up, while waiting at the our friend's house. 2 hours later, gal wake up out her nap to vomit again.",sadness,0.438,tried time sober up waiting friend house hour later gal wake nap vomit again
@alisontis otherwise you're committing a crime against your soul only sober ppl know what is good or bad for themselves,sadness,0.438,committing crime soul sober ppl know good bad
@rickygervais my first time in Slough so checked out the new station floor #sad #LifeOnTheRoad,sadness,0.438,time slough checked new station floor sad lifeontheroad
"Niggas murking in each other. In murky water, I try to swim.",sadness,0.438,nigga murking other murky water try swim
@talkRobyn oh dear I have to watch this the woman with the pout did well,sadness,0.438,oh dear watch woman pout did
As I lost my heart to you there in the dark.. Underneath the stars 🎧,sadness,0.438,lost heart dark underneath star
$FOGO max pessimism here and no bottom (yet).  Has a solid PE ratio for a restaurant.  Let's catch it at 8 level or 10 level if it comes.,sadness,0.438,fogo max pessimism yet solid pe ratio restaurant let catch level level come
@ThatWhiteSoxFan @tbtrill not as sad as the White Sox playing record ;),sadness,0.438,not sad white sox playing record
@BeeTuppy We're sorry to hear about the issues and how this is making you feel. We don't like to hear our customers being unhappy :-( We,sadness,0.438,sorry hear issue making feel not like hear customer unhappy
and naoto nod she also like tha bands. but she also frown. 'Will the bands 'Papa Roach' be at concert...?',sadness,0.438,naoto nod like tha band frown will band papa roach concert
@delhi_lawyer @BhagwanUvach @ShivAroor sad . This is not film story. Who knows could be ploy to escalate tension. Unverified report no hype,sadness,0.438,sad not film story know ploy escalate tension unverified report hype
@Samkingftw nahh thats grim,sadness,0.438,nahh thats grim
"It's my last week at CN! I'm gonna be sad to leave, but this will also be my first planned break since going into animation!",sadness,0.438,week cn gonna sad leave planned break going animation
