Text,Label,Score,text_cleaned
Has anyone noticed that @npr stories in recent days all paint positive accomplishments for Trump and challenges for Hillary? #surprised ,sadness,0.333,noticed story recent day paint positive accomplishment trump challenge hillary surprised
No quite sure how Craig Gordon's stayed on the park there !!,sadness,0.333,quite sure craig gordon stayed park
@courtneymee I'm 3 days sober don't wanna ruin it,sadness,0.333,day sober not wanna ruin
I wanna see you smile I don't wanna see you make a frown,sadness,0.333,wanna smile not wanna make frown
@KurakkuSora he is.\nSure his mind was clouded but...],sadness,0.333,isnsure mind clouded but
Snores on TL. Boredom sunk in.,sadness,0.333,snore tl boredom sunk in
Season 3 of penny dreadful is on Netflix...well my afternoon is filled,sadness,0.333,season penny dreadful netflixwell afternoon filled
Do not grow weary in doing good.'\n\n-@billclinton,sadness,0.325,not grow weary doing goodnn
@SheilaCustis We don't expect women to be violent &amp; discourage it. It's really about how we're raising our boys.,sadness,0.322,not expect woman violent amp discourage it really raising boy
"LOL! @TheFrankJLopes was just awarded the “F” bomb trophy on #AutoDealerLive, @RealMatKoenig :) #serious",sadness,0.321,lol just awarded f bomb trophy autodealerlive
Jay Z and Brad Pitt cheated ..Bey stayed Angie left #cheaters #love #lust #sex #couples #relationships #date #marriage #divorce,sadness,0.32,jay z brad pitt cheated bey stayed angie left cheater love lust sex couple relationship date marriage divorce
"Carry on my wayward son, there'll be peace when you are done. Lay your weary head to rest. Don't you cry no more. #Supernatural",sadness,0.318,carry wayward son peace done lay weary head rest not more supernatural
@Vixen85Webster yep &amp; I stayed in pjs all day too lol x,sadness,0.312,yep amp stayed pjs day lol x
For those of you who I have footage of but didn’t make it into this mix—don’t get discouraged! I ran out of room on the beat this week.,sadness,0.312,footage did not make mixdo not discouraged ran room beat week
@superbatlane it's true also that he doesn't escape until almost all the car sunk,sadness,0.312,true doe not escape car sunk
ordered my vacation bathing suits. one less thing to fret about.,sadness,0.312,ordered vacation bathing suit thing fret about
@cardiff_blues @CardiffBluesSC Italy another round lets not drop our play and take it to them with a big result out there guys #blues,sadness,0.312,italy round let not drop play big result guy blue
"@GriffinLaneP @Mediaite The Left has been protected so long, they've lost their reasoning power.",sadness,0.312,left protected long lost reasoning power
New job training= too much meat eating! Oh well. Also- got approved to drive for Lyft! Just need a car... #day35 #sober,sadness,0.312,new job training meat eating oh well also got approved drive lyft just need car day sober
If you sober better roll another Dutch or if u don't smoke nigga better pour another cup 🍁🍾...,sadness,0.312,sober better roll dutch u not smoke nigga better pour cup
Just put the winter duvet on ☃️❄️🌬☔️ #serious,sadness,0.312,just winter duvet
"@TetraVariations I don't need a mask, but I'll gladly make a donation to help in ur name! Is it Mr. TY Rex or first initial only? #serious",sadness,0.312,not need mask gladly make donation help ur name mr ty rex initial only
#sober life,sadness,0.312,sober life
need to sta dating again.I m bored #redheadteen #boldandbeautiful #lost #500aday single men dating Schkeuditz,sadness,0.312,need sta dating againi m bored redheadteen boldandbeautiful lost aday single men dating schkeuditz
@_Mrs_Peel @lp_lisa @PaulRGoulden @LisaLuscious Might be the pout of a star baker tho !,sadness,0.312,pout star baker tho
Had a dream last night that Chris Brown created a diss track about Drake and Rihanna called 'I Hit It First' 😳😳 #dark,sadness,0.312,dream night chris brown created dis track drake rihanna called i hit first dark
I got a short fuse when im sober.,sadness,0.312,got short fuse im sober
Already plotting next steps if I get cut off by the same minivan in tomorrow's drop-off line. #preschoolpolitics #momthings ,sadness,0.312,plotting step cut minivan tomorrow dropoff line preschoolpolitics momthings
Never let me see you frown,sadness,0.312,let frown
@xxnogard_G88 Welcome to the  dark honey !,sadness,0.312,welcome dark honey
@WriterlyTweets Supine on the piano—lips parted. #sixwordstory #amwriting #blues #singer,sadness,0.312,supine pianolips parted sixwordstory amwriting blue singer
7 pax enjoyed the #gloom @Clayorangecrush @F3LakeMurray,sadness,0.312,pax enjoyed gloom
Kinda wanna just book a vacation and go...anyone wanna tag along? #adventure #serious,sadness,0.312,kinda wanna just book vacation goanyone wanna tag along adventure
"@Cigna bows out for the moment. Rather than sulk, I'm going to @UCSF for an opinion from the guys studying #Oligodendroglioma. ✌️&amp; ❤️ &amp; 🍩's",sadness,0.312,bow moment sulk going opinion guy studying oligodendroglioma amp amp
I need a syfy series to watch I literally have nothing to watch back to back. I already watched #heroes #lost #jericho #fallenskies  etc etc,sadness,0.312,need syfy series watch literally watch back watched hero lost jericho fallenskies
@wabermes The @RavalliRepublic had a good one but then the reporter quit. ,sadness,0.312,good reporter quit
@jaymohr37 droop saw naked wrestling and asked 'What if I get a hole in one?' #jaymohrsports,sadness,0.312,droop saw naked wrestling asked what hole one jaymohrsports
@TheCatHeSay I may be #alwayshungry but I haven't sunk that low yet!! @Thereluctantcat,sadness,0.312,alwayshungry not sunk low yet
"Blessed are those who mourn, for they will be comforted \n                                              Mt 5:4",sadness,0.312,blessed mourn comforted n mt
@kelly_welles they were brilliant weren't they? Made me feel v dull not having one. And why no tattoo emoji! This'll have to do... ⚓️ x,sadness,0.312,brilliant not they feel v dull not having one tattoo emoji do x
"When tears r inappropriate: 'This day is holy to our Lord. Do not grieve, for the joy of the LORD is your strength.' Nehemiah 8:10 NIV #joy",sadness,0.311,tear r inappropriate this day holy lord not grieve joy lord strength nehemiah niv joy
@DefiantSagacity — Hermione in a sort of thank you before sliding his own plate away from him before frowning at Ron as he continued to —,sadness,0.306,hermione sort thank sliding plate away frowning ron continued
Let's get drunk and tell each other things we're afraid to say when we're sober.,sadness,0.303,let drunk tell thing afraid say sober
@chelseafc let them know it's the ,sadness,0.3,let know
"@FatedDancer ~together.' Hermione  lowered her voice slightly, sounding somewhat  bitter, perhaps even  rueful. 'That would only get you~",sadness,0.3,together hermione lowered voice slightly sounding somewhat bitter rueful that you
Band members wanted. Contact me #NewcastleGateshead #Sunderland #musicians #musicbusiness #musicislife #music #musically #band #blues #folk,sadness,0.299,band member wanted contact newcastlegateshead sunderland musician musicbusiness musicislife music musically band blue folk
Been working in Blanchardstown shopping centre for over 2 years now and I only figured out today where Marks &amp; Spencer's is ,sadness,0.292,working blanchardstown shopping centre year figured today mark amp spencer
"#AskAMan but this does not sound like a #serious issue, cause siyahleka the whole time, just having fun",sadness,0.292,askaman doe not sound like issue cause siyahleka time just having fun
"@cherrivarisco @audubonsociety Oh yes, males are colourful and the Females are dull, so that they can blend in to their environment.",sadness,0.292,oh yes male colourful female dull blend environment
My name is John Locke and you can't tell me what I can and can't do #lost #アニメ,sadness,0.292,john locke tell lost
ya boy gets mad tired of pine trees,sadness,0.292,ya boy get mad tired pine tree
i wonder how a guy can broke his penis while having sex? #serious,sadness,0.292,wonder guy broke penis having sex
"@NianticLabs .... For example, catching a gloom would yield 6 oddish candies and catching a vileplume would yield 9.",sadness,0.292,example catching gloom yield oddish candy catching vileplume yield
@markoheight @Cassie_OB we sound like vampires saying we wanna sink our teeth into the TT lads and their talents 😂😂😂😂😂😂,sadness,0.292,sound like vampire saying wanna sink teeth tt lad talent
i love the word fret so much and im in heaven,sadness,0.292,love word fret im heaven
"Marcos Rojo Marcos Rojo running down the wing. Loved by the blues, feared by the reds",sadness,0.292,marcos rojo marcos rojo running wing loved blue feared red
@rickygervais my first time in Slough so checked out the new station floor  #LifeOnTheRoad,sadness,0.292,time slough checked new station floor lifeontheroad
@BillSwindell @DePauwU @dick_nixon I was having breakfast when I seen this?! I blew my cereal in the #sink!!,sadness,0.292,having breakfast seen this blew cereal sink
#PeopleLikeMeBecause of some unknown reason but I try to discourage it,sadness,0.278,peoplelikemebecause unknown reason try discourage
Bill Clinton: 'Do not grow weary of doing good.' @ClintonGlobal #CGI2016,sadness,0.275,clinton do not grow weary doing good cgi
.@billradkeradio is not a fan of The Beat Happening. But that's not to discourage aspiring other Olympia musicians! #KUOWrecord,sadness,0.274,not fan beat happening not discourage aspiring olympia musician kuowrecord
@Piggiewhopays lmao! I can only imagine the frown across that face of yours. #Hilarity,sadness,0.271,lmao imagine frown face yours hilarity
@TweeriaLee A stumbling block to the pessimist is a stepping stone to the optimist.,sadness,0.271,stumbling block pessimist stepping stone optimist
Do not be discouraged by a slowing sales market. This will test your business model and pinpoint #strengths and #weaknesses.' @Ken_Dunn,sadness,0.271,not discouraged slowing sale market test business model pinpoint strength weakness
When you get lost in a neighborhood and have to use the gps on your phone to find your way out. #lost #GoogleMaps #blondmoment,sadness,0.271,lost neighborhood use gps phone way out lost googlemaps blondmoment
@emorottie true sonicsatam was serious and a bit dark. Aosth is like super goofy and Looney toonie to a degree,sadness,0.271,true sonicsatam bit dark aosth like super goofy looney toonie degree
TGIF! Hope everyone that needs to find #recovery can and that our friends stay #sober this weekend! @REBOSTreatment @BlvdCenters,sadness,0.271,tgif hope need recovery friend stay sober weekend
@pxrfectpeach it's got her little pout,sadness,0.271,got little pout
"@darryella it doesn't chip and it doesn't get dull. Nails gone be looking perfect the whole time, except they gone be grown out 😂",sadness,0.271,doe not chip doe not dull nail gone looking perfect time gone grown
it didn't impress me but it didn't depress me',sadness,0.271,did not impress did not depress me
"“Do not fret if you are not cool! Humans who follow me, become instantly cool!” #Bot",sadness,0.271,not fret not cool human follow me instantly cool bot
The #pessimist complains about the wind; the #optimist expects it to change; the realist adjusts the sails.' - William Arthur Ward\n#IGNITE,sadness,0.271,pessimist complains wind optimist expects change realist adjusts sail william arthur wardn ignite
"@littlemore20 I had a nice Italian ice-cream whilst resting my tired paws. Honey flavoured, naturally! #FurryTails #lost #Venice.",sadness,0.271,nice italian icecream whilst resting tired paw honey flavoured naturally furrytails lost venice
I added Paul Walker on Xbox but he just spends all of his time on the dashboard. #dark #humor #funny,sadness,0.271,added paul walker xbox just spends time dashboard dark humor funny
How much time should I give to my friend who lost his laptop to mourn before I can ask him to give me his laptop charger and extra battery??,sadness,0.271,time friend lost laptop mourn ask laptop charger extra battery
i can't take u #serious unless u use #emojis,sadness,0.271,u unless u use emojis
"Back to forest drama -\nfrom my #Forest #music - series, 2016\n#nature #dark #art #photography #Finland",sadness,0.271,forest drama nfrom forest music series n nature dark art photography finland
"@makai_kishi_ Her eyes stayed glued to the monitor, not turning away for anything",sadness,0.271,eye stayed glued monitor not turning away
"“Optimism may sometimes be delusional, but pessimism is always delusional.” —Alan Cohen #believe",sadness,0.271,optimism delusional pessimism delusional alan cohen believe
"God's love spring.Of one dat sunk his whole estate for d paltry bribe,of a single apple–n yet proud of our ancestry?❤️🗿",sadness,0.271,god love springof dat sunk estate d paltry bribeof single applen proud ancestry
That house on #GrandDesigns isn't in a forest it's in a wibbly wobbly pine plantation,sadness,0.271,house granddesigns not forest wibbly wobbly pine plantation
Beats is accurately all-powerful with respect to high-quality high-frequency speaker in re the extra desolate relating to fire-ea:…,sadness,0.271,beat accurately allpowerful respect highquality highfrequency speaker extra desolate relating fireea
gloomy weather puts me in the best mood,sadness,0.271,gloomy weather put best mood
Dad asked if I was too hungover to function today. Little does he know I stayed sober last night so i could get shit faced tonight 😅,sadness,0.271,dad asked hungover function today little doe know stayed sober night shit faced tonight
The American Idiot record turns twelve today it changed my preppy middle school heart into a desolate punk rock desert I am forever grateful,sadness,0.271,american idiot record turn today changed preppy middle school heart desolate punk rock desert forever grateful
"tones - \n: 1/2 of my favourite chris pine stans. i love tones more than anything, mt sweet summer child i will attack anyone who hurts her",sadness,0.271,tone n favourite chris pine stans love tone anything mt sweet summer child attack hurt
"Amateurs sit and wait for inspiration, the rest of us just get up and go to work.' -- Stephen King #authors #serious #writingtip",sadness,0.271,amateur sit wait inspiration rest just work stephen king author writingtip
@hotelplanner I stayed at a hotel who  packed picnic lunches to take on the road!! #BetterTogether @Redlizzy1 @NewfieChic @Ladybug_Vic,sadness,0.271,stayed hotel packed picnic lunch road bettertogether
@cburt43 turn that frown upside down,sadness,0.27,turn frown upside
"@iJuvia_ \n\nHearing the noises, Akame opened her eyes and sat up, facing Juvia. She didn't expect at all to see someone around and staid --",sadness,0.266,nnhearing noise akame opened eye sat up facing juvia did not expect staid
"@petercoffin So safe blues are ok. Are reds ok as well? Obviously, battleground states would not.",sadness,0.263,safe blue ok red ok well obviously battleground state not
"Hello fellow #horror #creepy #dark #stange #story fans, how's your day? #followme and I'll #followback",sadness,0.263,hello fellow horror creepy dark stange story fan day followme followback
@DDandDeltaboys will be playing in the Bridge Bar @RameltonWhatsOn this sat (24th Sept) #blues #rhythmandblues #ramelton #donegal,sadness,0.254,playing bridge bar sat th sept blue rhythmandblues ramelton donegal
"Oh goodness I'm loving this rainy  day. It's a head down, #creative cap on, &amp; get #lost in your #thoughts kind of day 💭 ☺️ #art #create #biz",sadness,0.25,oh goodness loving rainy day head down creative cap on amp lost thought kind day art create biz
No one wants to win the wild card because you have to play the Cubs on the road. ,sadness,0.25,want win wild card play cub road
"#Jazz - the #blues is the roots, the rest is the fruits",sadness,0.25,jazz blue root rest fruit
Well i did hear once before that girls are attracted to men that look like their dad!  👌 ,sadness,0.25,did hear girl attracted men look like dad
"The labor of love is not cheap or inexpensive, it's the time spent earning it. #lackadaisical #dreamer",sadness,0.25,labor love not cheap inexpensive time spent earning it lackadaisical dreamer
BLUES with BOB HADDRELL &amp; Guests\nFri 23rd Sep 8:30pm - 11:00pm #blues #free #TunbridgeWells,sadness,0.25,blue bob haddrell amp guestsnfri rd sep pm pm blue free tunbridgewells
@RashidAlMaktoum For #serious #intermediaries all required info about #project or #Owner will be mailed.,sadness,0.25,intermediary required info project owner mailed
"9/30 Howland Cultural Center, #BeaconNy Vickie Raabin &amp; Chris Raabe #blues #soul 8pm  @LocalMotionWVKR @hiddencitiesnyc 845-831-4988",sadness,0.25,howland cultural center beaconny vickie raabin amp chris raabe blue soul pm
#FF \n\n@The_Family_X \n\n#soul #blues &amp; #rock #band\n\n#music from the #heart\n\nWith soul &amp; #passion \n\nXx 🎶 xX,sadness,0.25,ff nn nn soul blue amp rock bandnn music heartnnwith soul amp passion nnxx xx
Mmmm #coffee and a good #book on a dreary day! Who can beat that?,sadness,0.25,mm coffee good book dreary day beat that
"Sometimes I can't believe I've made it this far.169 days!! I threw out my demons n got #sober #clean, n started #recovery.#Sobriety is #2.",sadness,0.25,believe far day threw demon n got sober clean n started recovery sobriety
"All clouded out.\n\n Considering using a camera, 1) star trails 2) eyepiece projection.",sadness,0.25,clouded outnn considering using camera star trail eyepiece projection
"Learning to trust God can quiet a troubled &amp; restless heart, bring peace to a weary soul, &amp; eliminate the hopelessness that #addiction is!",sadness,0.24,learning trust god quiet troubled amp restless heart bring peace weary soul amp eliminate hopelessness addiction is
A pessimist sees the difficulty in every opportunity; an optimist sees the opportunity in every difficulty. \n― Winston S. Churchill #quote,sadness,0.238,pessimist see difficulty opportunity optimist see opportunity difficulty n winston s churchill quote
Alt-J - Hunger of the pine.,sadness,0.235,altj hunger pine
these grown ass lil boys yeah i can't take them serious.,sadness,0.235,grown as lil boy yeah serious
"Be strong &amp; courageous. Do not be terrified or discouraged, for the LORD your God will be with you wherever you go.",sadness,0.229,strong amp courageous not terrified discouraged lord god go
Let the #MrRobot binge begin. #nerdshow #compelling #dark,sadness,0.229,let mrrobot binge begin nerdshow compelling dark
Anyway I'm in a car with a furious white men and I have a really funny story to tell when I'm sober 😂,sadness,0.229,car furious white men really funny story tell sober
"#RiceFODays now I am Alex Butler's class on financial management. Starts off with a great, relevant class discussion: movies and sunk costs",sadness,0.229,ricefodays alex butler class financial management start great relevant class discussion movie sunk cost
"There is no dark side in the moon. In fact, it's all dark.'\nGerry O'Driscoll at the end of 'The Dark side of the Moon'",sadness,0.229,dark moon fact darkngerry odriscoll end the dark moon
@BluesfestByron second artist announcement looking good #bluesfest2017  #Music #byronbay,sadness,0.229,second artist announcement looking good bluesfest music byronbay
now playing yung fav song ni chavs #sober 😂,sadness,0.229,playing yung fav song ni chavs sober
"@BlurtAlerts 'the darkest of nights can be bright, the solemn of faces lights up with a smile'. -@Totemprince believe in me, as I do in you",sadness,0.229,nothe darkest night bright solemn face light smile believe me
@kcbbcxo don't get discouraged! it's early on &amp; it can get overwhelming. keep reading &amp; use cue cards 😊 it'll get better!!,sadness,0.229,not discouraged early amp overwhelming reading amp use cue card better
Damn gud #premiere #LethalWeapon...#funny and ,sadness,0.229,damn gud premiere lethalweapon funny
I can't mourn Kid Cudi cause we have Travis Scott...,sadness,0.229,mourn kid cudi cause travis scott
"Be joyful in hope, patient in affliction, faithful in prayer. Romans 12:12",sadness,0.21600000000000005,joyful hope patient affliction faithful prayer roman
Isaiah 40:31\nthose who trust in the Lord will find new strength.\nThey will soar high on wings like eagles.\nThey will run and not grow weary.,sadness,0.214,isaiah nthose trust lord new strengthnthey soar high wing like eaglesnthey run not grow weary
"@AMB4JC @drtonyevans It's our job, the job of people who r still sane,still ok in life, to help the lost to find themselves &amp; love eachother",sadness,0.214,job job people r sanestill ok life help lost amp love eachother
Unmatched Party Specialist /co @T3RevNeverEnd #serious #job #titles,sadness,0.208,unmatched party specialist co job title
"Honestly don't give af who wins out of us and pine, I'm just worried about getting drunk Saturday night😂",sadness,0.208,honestly not af win pine just worried getting drunk saturday night
I don't think Luca understands how serious I am about Fall....he has no idea what's in store for him 😂😂,sadness,0.208,not think luca understands fallhe idea store
I keep feeling the heaviness on my left hand and look down and I am in awe every single time 😍💍 #notusedtoit #imafiancée #wut,sadness,0.208,feeling heaviness left hand look awe single time notusedtoit imafiance wut
the rappers who stayed true to the game is rich.,sadness,0.208,rapper stayed true game rich
@thetroche94 @ramiro_cedeno yeah if you want to become obese it is! 😅 I can afford it so I don't think it's that serious haha,sadness,0.208,yeah want obese is afford not think haha
@Hails_Berry8 @sajedhariri23 varsity pine riding,sadness,0.208,varsity pine riding
The difference between someone's selfies when they're happy vs. unhappy is absolutely amazing.,sadness,0.208,difference selfies happy v unhappy absolutely amazing
@KatelynKolsrud thanks mucho kate💕 #sober,sadness,0.208,thanks mucho kate sober
@hyattd335 #Grateful for #novel #award #promo #RT - #Blessings DeWayne Hyatt #Hippie who loves to grind on the #blues #Florida,sadness,0.208,grateful novel award promo rt blessing dewayne hyatt hippie love grind blue florida
@CrucialBMXShop ohh silver lake came up a lot on there! Is that where you guys stayed?,sadness,0.208,ohh silver lake came lot there guy stayed
"@Damn_It_Dillon @SamUndomiel of course! This is a happy hentai, not a sad or gloomy one",sadness,0.208,course happy hentai not sad gloomy
@VaunWilmott @PrisonBreak @PBWritersRoom linc the sink,sadness,0.208,linc sink
"@Lesdoggg take me with you!! JK. Have fun, relax, get a massage or two and chill. Don't eat the cucumbers, most places frown on that.",sadness,0.206,you jk fun relax massage chill not eat cucumber place frown that
We stayed up all night long\nMade our drinks too strong\nFeeling ten feet tall\nRopes swinging into the water\nIn the middle of the night,sadness,0.2,stayed night longnmade drink strongnfeeling foot tallnropes swinging waternin middle night
why do i have such a thing for dark curly hAIR,sadness,0.196,thing dark curly hair
Well i did hear once before that girls are attracted to men that look like their dad!  👌 #serious,sadness,0.188,did hear girl attracted men look like dad
"A tummy full of steak, wine, key lime pine and cuddles on tap. What a way to turn around a stressful Wednesday 💛",sadness,0.188,tummy steak wine key lime pine cuddle tap way turn stressful wednesday
Free live music in DC tonight!  #blues with #MoonshineSociety at @thehamiltondc in the Loft starting at 10:30pm @FreeinDCBlog @WTOPFreebies,sadness,0.188,free live music dc tonight blue moonshinesociety loft starting pm
@hannah_2401 hannah stop being mournful and chill 💁,sadness,0.188,hannah stop mournful chill
Guys! Read my #fanfiction if you like #lost and #housemd I have one of each #tvshow -link in bio!,sadness,0.188,guy read fanfiction like lost housemd tvshow link bio
@m_giacchino will this be aired on radio or filmed? Lots of fans over the pond too! #wales ,sadness,0.188,aired radio filmed lot fan pond too wale
Very long day. Thank goodness for Bake Off to brighten up a weary Wednesday ☺ #GBBO,sadness,0.188,long day thank goodness bake brighten weary wednesday gbbo
"TONIGHT - Fulford Arms, York \nTOMORROW - Bank Top Tavern, Oldham\nNEXT SATURDAY- Big Hands, Manchester \n\n#livemusic #punk #blues #rockandroll",sadness,0.188,tonight fulford arm york ntomorrow bank tavern oldhamnnext saturday big hand manchester nn livemusic punk blue rockandroll
"I'm so proud he understands this, he shows love, thought and compassion    and it's not done in a clouded way..",sadness,0.188,proud understands this show love thought compassion not clouded way
blues bar,sadness,0.188,blue bar
"@GOP she's ahead in the polls &amp; after Trumps dismal performance at upcoming debate, it will be an easy win for Hillary.",sadness,0.174,ahead poll amp trump dismal performance upcoming debate easy win hillary
@urbaneprofessor roast them. Then risotto with sage and pine nuts,sadness,0.16699999999999998,roast them risotto sage pine nut
Happiness is always there. You just have to choose to see it. There's no point dwelling in the dark and ignoring the light of the stars.,sadness,0.16699999999999998,happiness there just choose it point dwelling dark ignoring light star
Good morning chirpy #SpringEquinox and your pensive sister #AutumnEquinox A perfect day however it is expressed 🌹🍁🌓☯️ #theBeautyofBalance,sadness,0.16699999999999998,good morning chirpy springequinox pensive sister autumnequinox perfect day expressed thebeautyofbalance
also who has amazon prime that would like to help a girl out LOL #serious,sadness,0.16699999999999998,amazon prime like help girl lol
